﻿CleanText;Rating
remboursement quasi impossible voleurs menteurs le lien de suivi de commande n pratiquement jamais fonctionnel j attends toujours mon remboursement depuis mi f vrier apr litt ralement plusieurs 10aines change par mail de promesses de remboursement venir puis en cours de demandes de la somme rembourser sur paypal annul e de promesses de remboursement ici la 12e semaine de 2024 puis sou 10 15 jours plusieurs reprises puis n en finit pa toujours autres promesses non tenues mensonges sur mensonges officiellement le service remboursement est toujours en train de process mon remboursement plus de 4 mois apr demande je suis donc r sili envoyer une lettre de mise en demeure avec accus de r ception en esp rant que cela fasse bouger le choses ce 1 toile est bien rit malgr le fait que je ne puisse rien dire sur le produit qui attirait tant c est bien dommage vous qui lisez cet avis je vous en prie fuyez allez voir la concurrence je ne sais pa il agit un probl de gestion financi ou de quoi que ce soit autre mais il semblerait que circular se repose sur l argent non rembours s client non satisfaits ne leur permettez pa de poursuivre leur tromperie edit apr la lettre de mise en demeure et mon commentaire assassin sur trustpilot j ai finalement rembours sou 10 jours tant de tracas et de soucis inutiles j tait pourtant plein espoir en achetant la bague merci circular;1
je fais partie de contributeurs de la premi heure ceux qui ont cru en votre vision qui ont investi non seulement de l argent mais de la confiance en retour nous avon eu droit quo voir plus;1
j aime le fait qu il n ait pa besoin abonnement la bague et l application fonctionnent parfaitement ensemble et j obtiens toutes le information dont j ai besoin sans frais suppl mentaires;5
bague qui fonctionner 2 ou 3jours service client contact dans la foul e garantie 92183 aucune r activit apres 8mois change il demandent de renvoyer la bague pour remboursement voir plus;1
une version slim qui fait clairement la diff rence fiable et discr te niveau software le phase de sommeil ne sont pa toujours bien tect e surtout pour l veil en attente une synch voir plus;4
remboursement sans fin j attends encore et toujours mon remboursement depuis le mois de mar alors qu il devait tre effectu sou 15 jours num ro de commande 1925536132 08 03 2024 demande paypal proc dure circular 19 03 2024 message de relance 1 r ponse du service client remboursement pr vu la 17e semaine de 2024 14 04 2024 message de relance 2 r ponse du service client remboursement en cours pr vu pour la semaine du 22 avril 2024 26 04 2024 message de relance 3 r ponse du service client remboursement serum effectu dans le 15 jours ouvrables 14 05 2024 message de relance 4 r ponse du service client remboursement ici la fin du mois 28 05 2024 nouvel demande paypal parce que je couvre que la premiere annul 28 05 2024 message de relance 5 r ponse du service client case escalated financial team urgent attention actively working resolve issue quickly possible provide update soon information 02 06 2024 message de relance 6 r ponse du service client je constate que votre remboursement est en cours de traitement et j ai repris contact avec le service concern afin de assurer que cela se fasse dans le meilleurs lais j envoie de rappel paypal et toujours rien cela fait 3 mois que je patiente et quand je fais un ni message de relance r pond nous chon de compl ter le remboursement ce mois nous vous invitons juste patienter un peu de qui se moque parle une somme con quente et je fais balader sans cesse depuis de mois j attends que vous trouviez une solution sans lai pour effectuer ce remboursement merci;1
de quoi liorer l exp rience circular la bague reste peu confortable la batterie ne tient pa plus de 2 jours c est bien plus court qu annonc le donn e ne sont pa facile comprendre un meilleur guide serait tr utile apr quelques jours utilisation de marque sont visibles sur la bague;3
remboursement impossible j ai command bague le 28 11 22 promettait un envoi au bout de 2 ou 3 mois l envoi eu lieu 6 mois plus tard manque de chance j ai chang adresse entre temp j ai donc signal aupr de circular qui prend bien en compte l information et annule l envoi et assure envoyer la nouvelle adresse silence radio pendant 6 nouveaux mois je pr f donc demander l annulation de commande demande est bien prise en compte et promet de rembourser plusieurs mois plus tard en proposant une date ferme et fixe laquelle circular engage cette fameuse date arrive aucun remboursement je relance deux semaines plus tard laissant un temp l entreprise au ca certains probl me subsistent toujours pa de remboursement mais un message excuse je relance alors une derni fois le 18 mai 2024 cette fois en mettant en demeure l entreprise de rembourser avec un lai une semaine mais rien non plus r sultat j attends toujours le remboursement j ai remarqu qu en passant par trustpilot certains content ont eu r sultat de cause alors je tente ici veuillez rembourser;1
service client l coute le service client l coute et su faire une offre tr int ressante;5
moins que pa rieux suite pour faire suite mon avis moins que pa rieux puisqu il semble qu il n ait que par trustpilot qu il soit possible avoir un contact je suis au regret de vous dire que c est mon mail du 18 04 qui pour le moment est sans r ponse de la part de circular le message automatique envoy par l ia n attendant aucune r ponse;1
bon produit mais manque de finition la bague est tr bien elle est tr fine le fonctionnalit sont tr importantes l assistant personnel est un vrai plus le faite que l application ne soit pa payante par rapport aux concurrents est galement un point important elle est waterproof seul le lais de livraison qui sont tr long sont un b mol cet achat dont je suis tr content maj du 24 06 2024 la bague rencontre de tr gros souci de connexion bluetooth et reste inaccessible pendant 1 2j si le service client est rapide r pondre le probl n est toujours pa r solu et je commence perdre patience qui plus est l autonomie est trop juste 1 2j maxi je passe une autre marque un concurrent certes un peu plus cher mais plus fonctionnel;2
je n ai tjs pa u bague circular je n ai tjs pa u bague circular command e il plus un mois;4
la p riode talonnage est sup rieur la p riode talonnage est sup rieur 14jrs comme indiqu initialement et doit lanc manuellement le conseil je doute galement de r sultats de mon sommeil profond 5 en moyenne et moins que mon apple watch donc bof pa vraiment convaincu;3
j ai achet la bague slim j ai achet la bague slim au moment de l achat il tait indiqu un lais de 15jours j ai ue la bague plus de trois mois apr puis au bout de meme pa 2 mois elle ne fonctionne plus du tout et cela fait plus un mois que j essaie avoir le support technique pour r soudre le probl et bien chaque fois il faut attendre 2h minimum pour avoir une r ponse banal qui nous dit faire ceci ou cela comme indiqu dans la doc je que j avais j fait et dit bref ce jour j attends le contact du support qui ne r pond toujours pa j imagine qu il sont bord car je doute etre la seule avec une bague qui ne fonctionne pa suite la r ponse cela fait 1 mois que j ai donn toute le info meme fait installer une app suppl mentaire sur mon l phone je laisse juste ici un avis et je suis surprise de voir la vitesse laquelle vous r pondez alors que cela fait 3h que j ai rerererere envoy un message sur le chat bot de votre site et que je n ai pa encore de r ponse;1
bien je recommande je utilise quasi tous le jours;5
appel l phonique commerciale je n ai pa acheter de produit mais je trouve moyen appeler le client qui ont mi une bague dans leur panier sans avoir effectuer le paiement appel avec un 07 juste pour savoir le pourquoi du comment;1
avis tr negatif service client inexistant et la bague service client inexistant et la bague slim ne fonctionne plus au bout de 20 jours je conseille vivement cette achat j ai essay de la remplacer le service client repond que le service technique va tudier demande cela fait deux mois;1
je porte facilement la bague je porte facilement la bague meme pour le style haha bravo le mecs achet bien apr votre passage qvema j ai achete la derni version que recomment par conte;5
enfin un concurrent fran ai enfin un concurrent fran ai je soutiens;5
bien elle gagnerait etre plus precise sur activite physique mais sinon top;4
le pire achat de vie j ai achet la circular ring slim pour deux raisons principales le suivi du sommeil et le fait que ce soit une boite fran aise c est tout simplement la pire exp rience objets high tech que j ai eu jusqu pr sent j le lais de livraison sont monstrueux et la r ception j ai ue car la bague de asp rit et fauts de fabrication c est moche pour un objet qui est cens tre port comme un bijou voit de trace de colle au niveau du capteur je demande comment peut fonctionner correctement avec ce trace ailleurs ensuite apr seulement 3 jours elle ne fonctionnait j plus elle ne vibrait plus et ne voulait plus se connecter l app j ai contact le service client et l surprise r pond en anglais super je choisis une boite fran aise et le service client ne r pond pa dans langue heureusement que je parle anglais le change ont interminables vouloir faire faire de manipulation qui ne fonctionnaient pa je sais lira une faq pour finalement dire que le probl est plus technique et serum remont plus haut en parall le j ai laiss la bague se charger compl tement et j ai supprim mon compte et recr un nouveau et l par magie refonctionn sauf qu en r alit le donn e remont e par la bague sont totalement fausses ne correspond pa du tout ce que mon apple watch remonte et pour le sommeil raison principale de l achat c est n importe quoi je fais de insomnies et je r veille souvent au milieu de la nuit pendant plusieurs heures la bague elle dit que je dormais ce moment l je suis extr mement ue moi qui voulait donner une chance une marque fran aise j aurais mieux fait de prendre une oura ring ayant la bague depuis moins de 2 semaines je vais demander un remboursement mais au vu de diff rent commentaires je n crois pa trop c est vraiment honteux;1
un concentre de technologie au doigt un concentre de technologie au doigt l appli est top aussi;5
je recommande r ponse circular;4
j ai pris la circular ring slim design j ai pris la circular ring slim design sympa suivi sante fait le boulot;5
la bague ne fonctionne pa et aucune r action constructive de votre part la bague fonctionne partiellement pendant quelques jours et ensuite plus vous faites de nouvelles version du software et moins elle marche jusqu ne plus fonctionner du tout je vous ai crit 15 fois et chaque fois vous demandez de faire de choses qui n ont aucun effet si la bague n est pa remettre en question alors c est le software et dans un tel ca rien ne marche personne est capable de dire ce qui ne marche pa et le temp passe sans une r action professionnelle et votre garantie quoi sert elle;1
je fais partie de contributeurs de la premi heure ceux qui ont cru en votre vision qui ont investi non seulement de l argent mais de la confiance en retour nous avon eu droit quo voir plus;1
j aime le fait qu il n ait pa besoin abonnement la bague et l application fonctionnent parfaitement ensemble et j obtiens toutes le information dont j ai besoin sans frais suppl mentaires;5
bague qui fonctionner 2 ou 3jours service client contact dans la foul e garantie 92183 aucune r activit apres 8mois change il demandent de renvoyer la bague pour remboursement voir plus;1
une version slim qui fait clairement la diff rence fiable et discr te niveau software le phase de sommeil ne sont pa toujours bien tect e surtout pour l veil en attente une synch voir plus;4
dommage je viens de lira le diff rent avis et je vois que le probl me remont e sont toujours plus ou moins le me que ceux que je rencontre je suis ue par ce produit c est vrai je l ai eu 2024 le 13 jour de calibrage impossible de la synchroniser elle ne vibrait plus bref 5 jours pour qu elle soit de nouveau operationnelle avec de donn e compl tement farfelues du coup n anmoins pendant ce lap de temp le service client toujours r pondu je n ai rien reprocher de ce c l moins de trois semaines apr belote et depuis eh bien c est tous le jours la surprise parfois elle ne synchronise aucune donn e le horaires de sommeil sont effectivemment souvent fausses donc inutiles le graphiques ne sont pa vraiment parlant j aime bien par contre la fonction reveil avec la vibration noter aussi qu en mode performance il faut la recharger tous le jours la mienne est j consid rablement ray e et je boss derri un cran j ai choisi cette bague parce que fran aise mais je pense que le produit n est pa abouti au final je pense que je ne l utiliserais plus tr longtemps c est finalement devenu une contraire et une source de frustration supplementaire dans vie dommage;2
bague satisfaisante bague satisfaisante je suis impressionn e par le nombre de fonctionnalit que cette bague nous offre le reveil par vibration le analysis de sommeil est le diff rent conseils de kira sont tr utiles;5
vibrez de bien tre avec la slim et kira avec la slim c est tout simplement g nial vous savez ce qui vraiment impressionn sa fonction de vibration elle est parfaite pour r veiller en douceur le matin sans l agression une alarme bruyante et quand je dite pour g rer mon stress elle envoie de l g re vibration apaisantes qui aident concentrer et g rer respiration c est incroyable de voir quel point une simple sensation peut transformer journ e et avec l assistant kira int gr e circular ring slime utilise de recommandations intelligence artificielle pour analyser me triques et fournir de conseils personnalis que ce soit pour liorer mon sommeil augmenter mon niveau activit ou r duire mon stress le conseils de kira sont toujours pertinents et adapt me besoins sp cifiques c est comme avoir un coach personnel port e de main qui guide vers un mode de vie plus sain et quilibr avec la circular slim et kira je sen vraiment connect sant une mani nouvelle et innovante c est bien plus qu une simple bague c est une v ritable source de bien tre au quotidien;5
fuyez j attends le remboursement de bague fectueuse depuis f vrier 2024 toujours de r pons standardis e navr sol je comprends nous faisons le maximum bug technique service financier en reste un non respect lib r de engagement crits et parall lement depuis mar je demande lib r ment le coordonn e du diateur de la consommation dont pend l entreprise ce renseignement pourtant obligatoire ne figure ni sur le site de circular ni sur le cgv ni sur le bons de commande et je n ai toujours aucune r ponse malgr le demandes r p e 2 violation lib r e de lois r gissant le commerce lectronique;1
tr satisfait de la bague tr satisfait de la bague je recommande pour un usage quotidien;5
produit r volutionnaire r ponse circular;5
circular fuir utilisation circular slim depuis 3 mois environ la bague se raye facilement je n ai pourtant pa un tier manuel et comme elle n est pa teint e dans la masse c est moche et tr visible le soir e l sont tect e comme du sommeil et faussent compl tement le r sultats le donn e biom triques semblent souvent farfelues l infrastructure r seau est plorable du c de circular avec de latences normes et de pannes r p titions avec perte de donn e quand la bague est quasi charg e 10 elle passe en mode mort et c est la croix et la banni pour la r veiller compter une journ e de perdue et beaucoup effort pour arriver la r veiller l autonomie est 48h en mode performance mode obligatoire si l veut surveiller son sommeil et la recharge prends plut 2h30 que le 45 minute comme annonc e bien que l application soit en fran ai tous le mail sont en anglais ce qui peut g ner beaucoup de personnes pourquoi ne pa adapter la langue chaque profil utilisateur je arr te l pour le grief je regrette avoir pen de l argent pour et r fl chi passer la concurrence;1
cevant 18 mois entre le paiement et la livraison application ficiente score calcul tr pisodiquement support donnant de aide farfelues et inutiles depuis deux mois le bilan de mon exp rience est rieusement cevant va peut tre liorer mais pour l instant j ai juste une bague moche inutile et ch;1
j appr cie vraiment de porter cette bague j appr cie vraiment de porter cette bague au quotidien il parfois quelques petits bug mais bien vite r solus;4
je viens de recevoir bague je viens de recevoir bague c est au top pour l instant h te de voir l arriv e de nouvelles fonctionnalit;5
excellent et interactif excellent et interactif;5
une bague unique en son genre une bague unique en son genre la bague circular est unique et fonctionne bien je suis mon sommeil et me nuits gr ce elle et le conseils prodigu par kira sont tr int ressants;5
viter viter la suite de commande qui mi plus de 3 mois arriver alors que le site indiqu en stock j ai u bague enfin je la mets et la trouve un peu serr apr 3 jours utilisation et 2 recharges la tenue de la batterie est vraiment bien en dessous de valeurs indiqu e sur le site alors peut tre du fait qu elle soit obligatoirement en mode perf pendant 14 jours je rends compte qu il un 10 l int rieur de la bague alors que la bo te indiqu bien la taille commande soit la taille 11 j ai donc contacte le service client qui r pondu le message ci dessous bonjour benjamin merci de nous avoir envoy ce photo je suis terriblement navr de cette erreur si la taille de votre bague ne correspond pa vous avez deux option premi option si la bague est vraiment neuve et sans rayures nous pouvons la changer gratuitement vous n aurez qu payer le frais de retour et de nouvel envoi nous vous demanderons de photo de la bague et attendrons de le recevoir avant de vous envoyer une autre taille vous voulez faire comme deuxi option si la bague est ray e et n est pa neuve nous pouvons vous accorder une remise importante pour en acheter une autre et vous pouvez offrir votre ancienne bague quelqu un ou la recycler comme n importe quel produit lectronique n h sitez pa nous faire savoir quelle option vous convient le mieux honteux pour information oui la bague est fortement marqu e ray e apr seulement 3 jours une utilisation normale et je suis informaticien et pa canicien sans r ponse positive soit du remboursement soit un change par la bonne taille gratuitement je porterai plainte par voix avocat je n h siterai pa payer un avocat pour ne pa laisser faire par ce pratiques commerciales honteuse reponse votre reponse si vous ne vous etiez pa trompe dans votre emballage et dans votre envoi je n en serai pa la vous etes de voleurs je ne suis pa responsable de vos problemes envoi comment je suis cens savoir que votre emballage ne corresponds pa votre produit je vais de suite porter plainte je prefere payer 1500 euro avocats plutot que de vous laisser gagner sur ce conflt;1
bonjour bonjour part le probl me r current concernant le remont e information de la bague l application il serrait souhaitable de pouvoir modifier manuellement le heures du coucher en effet en ca inactivit du soir devant une mission de tv la bague passe en mode de sommeil ce qui donne au matin de fausses information de notre nuit excellente fin apr midi;2
une version slim qui fait la diff rence une version slim qui fait clairement la diff rence fiable et discr te niveau software le phase de sommeil ne sont pa toujours bien tect e surtout pour l veil en attente une synchronisation de donn e en background produit en constante progression qui reste bien au del du niveau de s concurrents;4
bague connect e utile au quotidien bague connect e tr utile pour une utilisation quotidienne et notamment pour me entrainements sportifs suivi fiable et de qualit discr te et esth tique;5
4j et puis ca marche plus rieux de la soci fuir mise jour 14 05 2025 bague renvoy e en cembre dernier apr 1an de bataille avec le service client mail ce jour aucun retour ni remboursement malgr me relances mise jour du 7 juin 2024 92183 echange de mail sur change de mail et le service technique v rifie votre bague revient vers vous de que c est fait merci de faire cette manipulation merci de faire ceci merci de faire cela etc etc ca fait plus de 2 mois la bague march 4j remboursez moi prochain message je poste ici tous le change mail avec votre service client qui dit qu il attend le retour de votre service technique vous ne pourrez ainsi pa nier et le client seront inform de votre maniere de faire plus de 40 mail chang avec votre service client qui n de cesse de dire que le service technique va bient r pondre il n rien de compliqu la bague fonctionn 4j vous donnez un bon de retour et vous remboursez la totalit de la somme pay e pour l achat de cette bague hello avis que tous le autres commentaires bagues ue il 4j apr de mois attente avec une date de livraison repouss e de mois en mois je voulais absolument une bague connect e et circular ring slim semblait la bague la plus aboutit et circular une soci fiable quelle erreur ring slim h 4j apr l avoir ue contact par mail service client hier r ponse une ia sans int r je rempli le formulaire sur leur site une cata ca demande nom pr nom commande num ro du code bar sur la boite je rempli le tout valide et la j ai de erreurs en gros il faut un dans tous le champ donc oblig de mettre mon mail dans le champ num ro de commande dans le champ nom pr nom et idem dans le champ snu qr code je ne sais meme pa si mon message est parvenue au service client rien ne va sur leur site peut voir bague tanche ipx8 sur leur site dans la faq et ipx7 dans un mail u du 22mars autre point la bague est garantie 1an comment est ce possible puisque la garantie l gale en france est de 2ans adresse de la soci dans le mail u 34 avenue de champ elys e 75008 paris peut voir sur le site pappers fr que cet tablissement secondaire est ferm depuis le 03 11 2023 car nagement et que la soci est maintenant au 78 av de champ elysees 75008 paris 8 jour sur leur site bref pourrait dire que c est de tail mais il une foultitude de tail de ce type qui ne font absolument pa rieux pour une soci francaise de cette taille j esp r tre totalement rembours de bague h qui n jamais vraiment fonctionn e vibre quand elle le veut ajout de prise de dicament dans l appli mais rien ne se sauvegarde connexion bluetooth fonctionnant 1 coup sur 2 et j en oubli surement mais au vu de exp riences de chacun j ai de doutes affaire suivre je ne manquerai pa de mettre jour mon commentaire en fonction de la r action du service client je laisse donc mon num ro de commande ici;1
tr satisfaite r ponse circular;5
excellent je recommande le bagues circular 100;5
super produit et rapport qualit prix je recommande je laisse rarement de commentaires sur le produits que j ach te mais pour le coup je suis vraiment fan de ce produit circular est tout simplement g nial non seulement il permet de suivre la qualit de mon sommeil pour l liorer mais il fait tellement plus que autant plus que le c discret le rend beaucoup plus pratique qu une montre ou un bracelet ayant le me fonctions par exemple et que je trouve en g n ral un peu encombrants je ne r alise plus quel point je l utilise;5
je fais partie de contributeurs de la premi heure ceux qui ont cru en votre vision qui ont investi non seulement de l argent mais de la confiance en retour nous avon eu droit quo voir plus;1
j aime le fait qu il n ait pa besoin abonnement la bague et l application fonctionnent parfaitement ensemble et j obtiens toutes le information dont j ai besoin sans frais suppl mentaires;5
bague qui fonctionner 2 ou 3jours service client contact dans la foul e garantie 92183 aucune r activit apres 8mois change il demandent de renvoyer la bague pour remboursement voir plus;1
une version slim qui fait clairement la diff rence fiable et discr te niveau software le phase de sommeil ne sont pa toujours bien tect e surtout pour l veil en attente une synch voir plus;4
exp rience tr positive merci circular j ai achet cette bague afin de suivre mon bien tre au quotidien fait un peu plus un mois que je la teste et pour l instant je ne suis pa u une part je trouve la bague tr fine c est un avantage de taille je ne voulais pa sentir une montre constamment mon poignet de jour comme de nuit et j ai donc trouv cette alternative qui est top circular poss de une application tr compl te il beaucoup de fonctionnalit comme pouvoir se faire r veiller doucement grace aux vibration et liorer son cycle de sommeil gr ce un suivi quotidien information sp cifique que la bague fournit je recommande vraiment pour ceux qui cherchent liorer leur bien tre au quotidien;5
super bague j ai command cette bague j ai u temp et je suis tr satisfait un de meilleurs achats que j ai fait;5
c est une bague qui est bien sign e c est une bague qui est bien sign e mais aussi de haute technologie et tr satisfaisante pour le mesures sommeil cardiaques spo2 j adore le coaching sommeil la vague est tr l g et confortable;5
bague tr l g et esth tique bague tr l g et esth tique etant sportive il est important pour moi de suivre le donn e que l application de circular le propose je suis satisfaite du mon achat;5
tr satisfait de la bague tr surpris par la bague que je n imaginais pa etre aussi pr cise elle fourni de information taill e sur mon activit et particuli rement au sport et dans mon sommeil le conseils de l application ont permis liorer mon sommeil et r cup ration plus jolie et aussi pr cise que montre connect e je ne en pare plus;5
excellent produit excellent produit une bague pratique pour le monitoring sant sport avec un design l gant et minimaliste;5
circular beaucoup aid circular beaucoup aid sur me cycle du sommeil et norm ment autres l ments li comme mon nergie globale;5
le r veil par vibration le r veil par vibration une bague l g et pratique avec de fonctionnalit utiles je suis tr satisfaite de l avoir;5
tr bon produit tr satisfait de mon produit il correspond tout fait ce que j attendais;5
