﻿CleanText;Rating
je fais partie de contributeurs de la premi heure ceux qui ont cru en votre vision qui ont investi non seulement de l argent mais de la confiance en retour nous avon eu droit quo voir plus;1
j aime le fait qu il n ait pa besoin abonnement la bague et l application fonctionnent parfaitement ensemble et j obtiens toutes le information dont j ai besoin sans frais suppl mentaires;5
bague qui fonctionner 2 ou 3jours service client contact dans la foul e garantie 92183 aucune r activit apres 8mois change il demandent de renvoyer la bague pour remboursement voir plus;1
une version slim qui fait clairement la diff rence fiable et discr te niveau software le phase de sommeil ne sont pa toujours bien tect e surtout pour l veil en attente une synch voir plus;4
arnaque entreprise circular sur kickstarter circular lanc une campagne de financement travers kickstarter pour un nouvel anneau nomm circular 2 en mar 2025 une de promesses principale lors cette campagne de fournir toutes le fonctionnalit actuelles et future sans souscription ou abonnement lors un roul de la campagne 2 objectifs goal ont atteints bloquant ainsi 2 fonctionnalit suppl mentaires suivi pression art rielle et suivi du glucose ce fonctions de suivi tant de fonctions tr int ressantes pour leurs utilisateurs sont de puissants argument commerciaux afin de que la campagne puisse attirer un maximum de contributeurs le contributeurs la campagne ont ailleurs imm diatement augment de mani significative au vu de l int r et de condition acc sans frais ce fonctionnalit aucun moment lors de la campagne circular n mentionn le principe un abonnement sur le fonctions de la bague et ceci jusqu la cl ture de la campagne le 27 juillet 2025 apr la cl ture de la campagne et juste avant le de l envoi de bagues circular fait changer le termes de la campagne par kickstarter en int grant la mention un abonnement pour le fonctions se situant en objectifs suivi de la pression arterielle et du glucose ce jour et malgr de nombreuses demandes de contributeurs circular n est pa revenu en arri sur son intention de mettre en place un abonnement ni ne laisse de possibilit annuler la commande et de se faire rembourser;1
une trahison la hauteur de votre silence je fais partie de contributeurs de la premi heure ceux qui ont cru en votre vision qui ont investi non seulement de l argent mais de la confiance en retour nous avon eu droit quoi une volta face commerciale honteuse de promesses pi tin e et maintenant cerise sur le g teau la censure pure et simple vos engagement initiaux incluaient de fonctionnalit de sant ambitieuses pression art rielle glyc mie int gr e dans le produit aujourd hui vous le transformez en option payantes sans avertissement sans discussion et surtout sans respect ce n est pa un changement de cap c est une escroquerie peine gui e et plut que ouvrir le dialogue vous avez choisi la voie la plus l che supprimer le commentaires critique et bloquer ceux qui osent exprimer leur ception un pris total de votre communaut vous ne supportez pa la transparence ou est ce la v rit qui vous range ceux qui vous rejoindraient demain fuyez car derri le paillettes marketing se cache une r alit bien plus sombre une quipe qui renie s promesses prise s soutiens et efface le trace de s propres renoncements nous avon soutenu un projet pa une entreprise de microtransactions malhonn te honte vous;1
arnaque circular sur kickstarter circular lanc une campagne de financement travers kickstarter pour un nouvel anneau nomm circular 2 en mar 2025 une de promesses principale lors cette campagne de fournir toutes le fonctionnalit sans abonnement lors de la r alisation de la campagne 2 objectifs goal ont atteint bloquant ainsi 2 fonctionnalit suppl mentaires suivi pression art rielle et suivi du glucose ce fonctions de suivi tant de fonctions tr int ressantes pour leurs utilisateurs sont de puissants argument commerciaux afin de que la campagne puisse attirer un maximum de contributeurs aucun moment lors de la campagne circular n mentionn le principe un abonnement sur le fonctions de la bague et ceci jusqu la cl ture de la campagne le 27 juillet 2025 apr la cl ture de la campagne et juste avant le de l envoi de bagues circular fait changer le termes de la campagne par kickstarter en int grant la mention un abonnement pour le fonctions se situant en objectifs suivi de la pression arterielle et du glucose ce jour et malgr de nombreuses demandes de contributeurs circular n est pa revenu en arri sur son intention de mettre en place un abonnement ni ne laisse de possibilit annuler la commande et de se faire rembourser;1
depuis que je porte cette bague depuis que je porte cette bague je dors plus profond ment l application guide avec de bons conseils simple je sen mieux chaque matin;5
nul cette soci ne tiens pa s engagement produits fectueux au bout de 4 mois pa possible de remplacer et toujours pa rembours depuis 8 mois fuir pire service consommateur jamais vu le pauvres conseillers font ceux qui il peuvent pour supporter leur manager incomp tent;1
avis 9 le temp passe inexorablement r sum de pisodes commande 92668 14 06 24 prise de contact car circular slim est h 20 07 24 renvoi de la bague avec tiquette pr pay e 23 07 24 r ception par circular et depuis comme beaucoup je fais balader avec de fausses promesses j redressement judiciaire de circular en date du 8 10 24 donc comprend mieux le fait que le remboursements ne viennent pa le avoirs sont gel 6 07 25 tiens tiens toujours pa de remboursement j ai eu l argument de la liste attente bien r j ai saisi le diateur et circular n pa r pondu tape suivante avec signal conso circular n pa non plus r pondu il int ressent leurs client en sav donc je viens de contacter protection juridique car l depuis le 14 06 24 devient lassant pour circular vous allez avoir plus de frais de justice que mon remboursement de 273 mais ce n est pa mon probl ce n est pa faute avoir patient;1
n esperez pa passer la bague au n esperez pa passer la bague au doigt circular n est que du vent circular ne fabrique pa il revend un produit circular est un miroir aux alouettes brille beaucoup pour attirer mais il n rien derri si ce n est un coup de fusil circular n est rien autre qu un pi ge gogo une chose est si vous aimez le gadget et perdre de l argent c est le bon plan de triste exp rience;1
c est agr able de ne pa avoir besoin c est agr able de ne pa avoir besoin un abonnement la bague et l application fonctionnent parfaitement ensemble et j obtiens tout ce dont j ai besoin avec elles;5
j aime le fait qu il n ait pa besoin j aime le fait qu il n ait pa besoin abonnement la bague et l application fonctionnent parfaitement ensemble et j obtiens toutes le information dont j ai besoin sans frais suppl mentaires;5
la saga continue la saga continue toujours pa de remboursement effectif de commande pas e le 17 octobre 2024 il r pondent toujours tr gentiment qu il vont occuper rapidement de r soudre le probl mais il ne font rien apr avoir voqu de mani dilatoire plusieurs raisons de non remboursement dont la fameuse liste attente ou la fameuse adresse email pour le soi disant remboursement je pense que le rieux ou l honn tet n est pa la caract ristique principale de votre entreprise;1
aucune garantie bague qui fonctionner 2 ou 3jours service client contact dans la foul e garantie 92183 aucune r activit apres 8mois change il demandent de renvoyer la bague pour remboursement bague renvoy e en cembre aucune nouvelle malgr de relances passez votre chemin avec cette soci et cette bague si vous ne voulez pa perdre votre argent;1
passez votre chemin apr avoir essay obtenir pendant plusieurs mois un deuxi remplacement de bague j ai finalement demand un remboursement dure depuis fin cembre fait de notre mieux comprend votre frustration nous faisons tout notre possible bref que du pipo j ai j laiss un message ici il trois mois j ai eu la r ponse que beaucoup est sol va prendre contact et r gler le probl rapidement pa de contact pris et probl toujours pa r gl ce point l je pense qu peut consid rer que c est une arnaque;1
mefiez vous fuyer fiez vous il ne respecte pa le lais de r tractation j ai eu le malheur avoir acheter une circular ring quelques jours avant la sortie de la slim la premi n tant pa fiable j avais demand le remboursement de la slim et de la ring aucun de 2 n rembours il sont tr fort pour vous faire tourner en rond il pr textent de lais administratives et promettent de revenir vers vous mais pa de nouvelle et quand vous faites un rappel il donnent autres excuse il sont tr fort;1
attention grosse arnaque et scam attention grosse arnaque et scam promesse de remboursement et ou envoi de bague bidon attention ne vous faites pa avoir plus de 2 an attente commande en 2022 bagues mal finies qui arr tent et non fonctionnelles;1
mauvaise exp rience suite un soucis de taille de la bague le support propos de renvoyer la taille en dessous plut qu un remboursement ne voyant rien arriver le support dit qu il faudrait que j attende 3 mois pour la recevoir j ai demand alors un remboursement remboursement que j attends toujours depuis plus 1 mois maintenant malgr de multiple relances et qu il fallu que je demande via paypal car la proc dure standard n pa march la personne du support toujours r pondu me relances mais ne peut apparemment rien faire pour aider au remboursement;1
parfait petit compagnon agr able porter et tr utile pour conna tre s donn e corporelles id al comme assistant de suivi de sant;5
circular slim anneau fragile et non fiable circular slim command fin 2023 u en mar 2024 fonctionnement normal pendant 3 semaines puis l anneau est mort remplacement qui pris 1 2 mois le nouvel anneau fonctionn normalement 2 mois je pr cise que pour le 2 anneau j ai fait vraiment attention je ne le portais plus en faisant du sport pour ne pa l ab mer bref je r sou demander un remboursement 4 mois plus tard je suis toujours dans l attente un remboursement et balade pour demander tre patient et que va venir en r sum anneau tr fragile et non fiable service client ne faisant pa son boulot obtenir un remboursement pour un produit fectueux semble impossible;1
exp rience catastrophique viter j ai u 3 bagues et chaque fois la batterie n pa tenu plus de 6 mois maintenant cela fait pr un mois que j attends un remboursement mais rien ne vient bref c est le constat que pour beaucoup autres client;1
circular ring slim est tellement simple circular ring slim est tellement simple utiliser et ajuste parfaitement le information de sant sont tr pr cis et l alarme vibrante est un joli ajout;5
ce tracker de sant est incroyable ce tracker de sant est incroyable et le meilleur c est qu il n pa abonnement le suivi du stress est une super fonctionnalit et l application fournit de nombreuses donn e utiles;5
je fais partie de contributeurs de la premi heure ceux qui ont cru en votre vision qui ont investi non seulement de l argent mais de la confiance en retour nous avon eu droit quo voir plus;1
j aime le fait qu il n ait pa besoin abonnement la bague et l application fonctionnent parfaitement ensemble et j obtiens toutes le information dont j ai besoin sans frais suppl mentaires;5
bague qui fonctionner 2 ou 3jours service client contact dans la foul e garantie 92183 aucune r activit apres 8mois change il demandent de renvoyer la bague pour remboursement voir plus;1
une version slim qui fait clairement la diff rence fiable et discr te niveau software le phase de sommeil ne sont pa toujours bien tect e surtout pour l veil en attente une synch voir plus;4
le suivi du sommeil avec cette bague le suivi du sommeil avec cette bague est tr impressionnant elle fournit de donn e taill e et elle est si confortable que je ne la remarque pa quand je la porte;5
j ai achet cette bague il quelques j ai achet cette bague il quelques mois et elle est devenue un excellent ajout routine le suivi du sommeil est taill et l application regorge de donn e utiles;5
j utilise la circular ring slim tous j utilise la circular ring slim tous le jours et c est fantastique elle est l g confortable et suit sant parfaitement le fonctionnalit de l application sont galement excellentes;5
je suis satisfait de mon exp rience je suis satisfait de mon exp rience avec cette bague elle est incroyablement l g suit me donn e de sant correctement et l application est pleine de fonctionnalit;5
le design de cette bague est l gant et le design de cette bague est l gant et si l ger elle suit fr quence cardiaque et mon spo2 avec pr cision et l application est un outil utile pour le bien tre;5
la bague est facile porter la bague est facile porter et l autonomie de la batterie est correcte elle dure plusieurs jours elle est l g l gante et parfaite pour une utilisation quotidienne;5
cette bague est tr fine et facile cette bague est tr fine et facile porter toute la journ e elle suit la fr quence cardiaque et le sommeil avec pr cision et le exercices de respiration guid e sont vraiment utiles;5
cela tout une arnaque mise jour du 31 mar proc dure de diation conso et r pression de fraudes enclench e noter que l entreprise est en redressement judiciaire depuis ao 2024 mise jour du 21 f vrier toujours pa u de remboursement malgr relance il un mois par contre je ois bien le spam sur la nouvelle bague de promesses rien que de promesses si ici un mois rien ne bouge je vais contacter la dgccrf et le diateur conso valuation du 20 janvier ci dessous je ne relate pa le innombrables change par mail entre chaque tape parce que serum trop long sinon 2024 f vrier commande mai r ception septembre la bague est j hors service novembre remplacement annonc par le support cembre toujours pa de remplacement le support annonce un remboursement 2025 ce jour 20 janvier 2025 toujours pa rembours malgr de multiple relances je cide faire un retour trustpilot le support est r actif mais finit par se dire que ce n est qu une fa ade et qu il n rien derri je mettrai jour quand je serai enfin rembours noter que le avis positifs ci dessous sont de toute vidence de faux saute aux yeux quand prend le temp de le lira;1
fuir fuir la bague ne fonctionne pa et apr un retour demand aucun remboursement cela fait un que j attends et que l promet acc l rer le remboursement suite la r ponse de circular c est exactement ce que l r pond tous me mail depuis un;1
arnaque totale arnaque totale fuir j ai pay bague il 3 an vous vous rendez compte suite non r ception de bague apr 2 an j ai demand un remboursement et cela fait 1 qu il baladent dire nous somme en train de r soudre le souci et faisons le n cessaire pour acc l rer le processus mais rien aucun remboursement l horizon depuis 1 ce sont de manipulation pour ne rien rembourser ne leur faites pa confiance;1
du nouveau dans situation du nouveau dans situation il remboursent 164 06 euro au lieu de 254 06 bon je leur ai rappel certains article de code de la consommation et du code civil il sont vraiment magique ou sont pas le 90 euro manquant j ose esp rer qu il vont revoir leur copie avant que je passe l tape sup rieure le sav est assez r actif mais je pense bien brid par leur direction passez neanmoins votre chemin;1
fuyez circular ring slim v1 allez perdre temp et argent ailleurs bague circular slim v1 267 80 command e le 21 02 2024 ue 13 05 2024 avec promesse de livraison un 2 chargeur pour avoir autant attendu mais chargeur jamais u et bague totalement h le 18 10 2024 multiple change dilatoires avec le bot relna ou r pond comme tel entre le 19 10 2024 et le 19 12 2024 et depuis plus de son ni image seulement 2 mail u avec remise gracieuse annonc e env 85 pour remettre 100 dans leur bague v2 lorsqu elle serum commercialis e et v1 annonc e abandonn e au passage mais de qui se moque agissant un sav pour un objet attendu 3 mois et qui fonctionn 5 mois fuyez;1
pire exp rience client bonjour produit command en novembre 2023 u en janvier 2024 totalement cess de fonctionner le 20 02 2024 apr plusieurs change avec le service client refonctionne le 26 02 produit fonctionne de mani fectueuse partir du 27 05 apr de tr nombreux change avec le support et renvoi du produit pour analyse il est finalement chang le 03 09 2024 produit cesse totalement de fonctionner le 08 11 2024 nombreux change en cours avec le support pa de r solution date circular produit et support est pire exp rience client;1
compagnie diocre lente avec service la client le pourri j ai achet une bague en juin 2023 pour atteindre 6 mois de livraison pour avoir une bague qui tait fectueuse et qui dur e quelques semaines seulement maintenant cela fait maintenant plus un que j attends apr bague de remplacement et circular invente toutes sortes de conneries la compagnie est diocre personne ne va acheter de cette petite entreprise dans me contact je n ai jamais vu une compagnie aussi path tique noter que la date de l exp rience ci ba n est pa bonne car je ne pouvais pa aller plus loin que le 32 cembre 2023;1
un sav plorable un sav plorable apr plus un mois attente je n ai jamais u le produit le soucis de livraison et de logistique existent je ne leur en tiens pa rigueur le vrai probl est le service apr vente personne n jamais capable de donner une date approximative de livraison le r pons se contredisent le unes le autres et n taient que de copier coller de message pr r dig qui ne veulent rien dire apr deux semaines de palabres inutiles il ont enfin consenti rembourser l achat mais je suis retrouv sans cadeau offrir le soir de l le produit est certainement de qualit mais cela ne fait pa tout une grosse remise en question est pr voir;1
bague circular jamais vue pa exp di e mais r glement encaiss bague connect e command e le 8 novembre dernier 2024 exp dition toujours repouss e pour de multiple raisons fallacieuses et toujours pa exp di e le 27 cembre 2024 et encore moins ue il ne savent qu envoyer de courriels de report et retard pour diverses raisons annul la commande ce jour 27 12 2024 en attendant un remboursement complet car commande non ex cut e;1
fuir de toute urgence fuir de toute urgence j ai rep r cette entreprise dans la c l bre mission de m6 le concept et le produit ont vraiment emball e j ai attendu longtemps qu il se veloppent et mettent en vente la bague j croyais vraiment beaucoup j ai donc fait l achat de bague en novembre 2022 pour une livraison pr vue en mai 2023 le choses ont de suite mal commenc sachant que bague livr e avec plus de six mois de retard la taille n tait pa bonne en plus car entre deux tailles je l ai perdue j en ai donc rachet e une autre encore une fois en leur faisant confiance et depuis ce jour le cauchemar je n ai eu que de soucis le prix de la bague j con quent et j avais achet en plus la garantie expr quand ce n tait pa la bague qui ne se synchronise plus avec l application c tait de probl me de fonctionnement et de mesure de information de sant un peu le principal bref il avait toujours de probl me et cela mettait de semaines tre r solu en tout chang quatre fois la bague et chaque fois il eu de probl me et elles ne fonctionnait plus je crois que je l ai utilis au maximum un mois con cutif entre le service client et le 25 op rateurs diff rent auquel l affaire et qui r pondent chacun une version diff rente c est la catastrophe je demande un remboursement car j en ai plus qu assez avoir pay presque 300 pour un produit que je ne peux pa utiliser r pond qu il sont pr t envoyer le nouveau prototype de la bague en faisant un rabais mais que je doi rajouter 100 de poche le comble je leur maintiens que je veux un remboursement cela fait plus un mois que dure et je n ai toujours pa rembours e il essayent de gagner du temp il sortent toutes le excuse du monde abord c est parce qu il trop de demandes de remboursement en temp ensuite c est parce que si ensuite c est parce que promis un remboursement au 26 cembre 2024 maximum je sen gros comme une maison que je ne l aurais pa ici l crit pour demander une demande de remboursement paypal alors que j ai pay par carte bancaire j ai quand fait une demande de remboursement paypal pour le montant entier auquel j ai achet la bague et j attends toujours ce jour c est une honte bref produit plorable service client plorable si je n ai pa mon remboursement rapidement je saisis la justice et le association de consommateur et j irai jusqu au bout cela n que trop dur il faut arr ter de se payer la te de gen;1
cette bague rend le suivi de sant cette bague rend le suivi de sant amusant et simple j adore sa l g ret et application est remplie de fonctionnalit utiles;5
avec cette bague avec cette bague rester en bonne sant semble facile elle est super l g pr cise et application donne toutes le information j ai besoin;5
la circular ring slim int gre la circular ring slim int gre parfaitement mon mode de vie elle est l gante suit condition physique sans effort et application est bien con ue;5
je fais partie de contributeurs de la premi heure ceux qui ont cru en votre vision qui ont investi non seulement de l argent mais de la confiance en retour nous avon eu droit quo voir plus;1
j aime le fait qu il n ait pa besoin abonnement la bague et l application fonctionnent parfaitement ensemble et j obtiens toutes le information dont j ai besoin sans frais suppl mentaires;5
bague qui fonctionner 2 ou 3jours service client contact dans la foul e garantie 92183 aucune r activit apres 8mois change il demandent de renvoyer la bague pour remboursement voir plus;1
une version slim qui fait clairement la diff rence fiable et discr te niveau software le phase de sommeil ne sont pa toujours bien tect e surtout pour l veil en attente une synch voir plus;4
depuis que j utilise cette bague depuis que j utilise cette bague je sen plus en phase avec sant elle est confortable porter et application fournit de donn e pr cis et taill e;5
marceau quand j ai achet cette bague je ne attendais pa grand chose mais elle est r v l e incroyable l application fournit de mises jour claires et la bague est tr confortable;5
j utilise cette bague depuis de j utilise cette bague depuis de semaines et je ne peux plus en passer elle est g l gante et fournit de rapport taill sur sant via application;5
mon parcours fitness est devenu mon parcours fitness est devenu tellement plus facile gr ce cette bague elle suit tout parfaitement et application motive rester actif;5
fuyez achat de la premi bague circular arriv 6 mois en retard jusque l ok mais la bague tait fectueuse apr avec bataill pendant de mois il n ont pa accept de rembourser et ont envoy une seconde bague sans mon consentement alors que je n tait pa int res e aujourd hui en novembre 2024 je bataille depuis janvier 2024 pour faire rembourser le prix initiale de la bague je suis pr te renvoyer le bagues il ignorent vos mail disent qu il vous rembourseront la 14eme semaine de l ann e est en novembre incroyable puis il annulent vos demande de remboursement paypal ce jour 51 mail et aucun remboursement honteux non circular fuyez simplement car il arrive quelque chose vous n aurez pa de service client pour part c est une mise en demeure de part qu il vont tr prochainement recevoir si la situation ne se r gle pa;1
un ami recommand cette bague un ami recommand cette bague et je suis tellement content de avoir cout elle est l g l gante et rend le suivi de la sant tr simple avec application;5
routine de sant quotidienne est routine de sant quotidienne est tellement lior e avec cette bague elle est fiable la batterie dure longtemps et application est tr informative;5
je n ai pa r ali quel point je n ai pa r ali quel point j avais besoin de cette bague avant de commencer l utiliser elle est incroyablement l g et application donne toutes le information sur sant;5
lys au j tai sceptique mais cette bague convaincu elle est confortable suit tout ce dont j ai besoin et application fournit de statistiques claires;5
ne pa acheter 2d avis pour commenter la r ponse de circular mon 1ier avis circular fait cette r ponse depuis plusieurs mois sans jamais rembourser comment vont il rembourser partir de mon 1ier avis sachant qu il n aucune r f rence permettant de traiter mon dossier je r affirme mon conseil de ne pa acheter de produits cette entreprise sou peine de perdre votre argent;1
