Title,Content,Rating,Date,Author
,The RingConn has helped me better assess my sleep more than any other device has! I highly suggest this ring since there’s no monthly fee & the app shows some fun stuff coming on the horizon for the aSee more,5,2025-06-16T14:49:54.000Z,
,Love the idea of the ring. Somethings to note. It gets scratched very easily and I'm not expecting it to look great a year from now. Also there are no postpartum or pregnancy setting for the fertilitySee more,4,2025-06-18T23:43:57.000Z,
,Still relatively adjusting but so far everything has been as great as i expected. The only thing is that the app doesn’t take temp on demand- only when sleeping. Other than that- i love the purchase.,4,2025-06-16T11:11:52.000Z,
The ring has exceeded my expectation,The ring has exceeded my expectation! Very impressed with the data and the fact it is NOT a subscription.,5,2025-02-25T18:55:33.000Z,
I don't understand why the ring stops…,I don't understand why the ring stops working when it gets to 20%. It goes into search mode. I have tried everything and nothing works 😞,2,2025-02-25T17:40:32.000Z,
Horrible customer service,Horrible customer service when my ring wouldn’t work. It took over a month for them to begin to care. I never received a replacement nor a refund for my ring that lasted less than a month.,1,2025-02-25T16:53:40.000Z,
Great product! Shipping process could be refined.,"Product and value are great. The purchase experience was well thought out and overall nicely presented. Great care taken with the sizing kit. Only real downside is the shipping times. Especially when you take into account it takes twice as long when you do the sizing kit. Understandable considering things are shipping from China, but increasing your distribution presence in North America would really go a long way for the purchase process.",4,2025-02-25T16:26:26.000Z,
I haven’t received this item nor have I…,"I haven’t received this item nor have I received any updates. It’s like it was never ordered, however my credit was definitely charged.",1,2025-02-25T16:25:54.000Z,
Always,"Always, constantly disconnecting from phone",1,2025-02-25T16:14:13.000Z,
Ring conn is a joy to wear with amazing…,Ring conn is a joy to wear with amazing data sets. I just wish RingConn had a referral program. I’d sell a lot of them.,5,2025-02-25T16:13:26.000Z,
"Great Ring, Great Service","I found this product via Kickstarter and have been pleased throughout the entire journey. The ring itself is comfortable, affordable (but not in any way cheap), and carries great functionality. Mine seemed to stop working after about ~6 months, but customer service was immediate to respond and sent me a new ring within a week. Great experience overall. Would recommend.",5,2025-02-25T14:35:28.000Z,
Not happy with the measurements so far…,"Not happy with the measurements so far , some time they are just not accurate",2,2025-02-25T04:01:19.000Z,
"Works great, needs better instructions.","The ring is attractive and does everything I expected. I only wish there was a more in depth, comprehensive guide showing you all the things that it can do. Even after 3 months with the app I'm still discovering new things I can do with it, so something up front to help familiarize us with everything it is capable of would be appreciated.",4,2025-02-24T19:48:53.000Z,
Great fitness tracking device,"Great fitness tracking device! Easy to use and fun to look at all the metrics. Helpful in detection of sleep abnormalities, which is primarily why I bought this.",4,2025-02-24T16:21:33.000Z,
Great Ring Overall,"I got the ring initially to wear at night for sleep tracking, in place of my Garmin watch. The ring's accuracy is equal to or better than my watch. The battery life last for a week, which is great and lets me charge it during lunch once a week.",5,2025-02-24T16:11:26.000Z,
Very good quality and amazing clearness…,"Very good quality and amazing clearness about bodyfunctions, sleep and Apnoe. Only missing sports opportunities… only walking isn‘t enough… Fitness, riding etc. would be nice.",4,2025-02-24T12:59:51.000Z,
fantastic ring,"fantastic ring. easy to wear, long battery, pretty, efficient. Tells me everything I need to know and no subscription.",5,2025-02-23T20:28:07.000Z,
strong and reliable battery life.,"strong and reliable battery life.
Sleep hours' parameter accuracy is close to real-time, which is amazing for triggering a health-conscious mindset.",4,2025-02-23T19:44:46.000Z,
Very informative,"Very informative, helpful and platform friendly",5,2025-02-23T19:07:47.000Z,
Excellent product,"Excellent product, accurate readings and helpful information/feedback to improve your overall health! I highly recommend this product",5,2025-02-23T18:21:47.000Z,
When I exercise,"When I exercise, it count as stress! When I excersice, it doesn't usually count as activity. There is no options for Yoga, meditatition etc.

The ring doesn't automatically sync with the APP, it should be and send me notifications in the APP in case of sedentary and other parameters.

It should also suggest how to improve my goals etc. Though it does more suggestion is appreciated.

The battery life and the pouch is one of it's kind and is the best thing with the ring.",3,2025-02-23T17:27:55.000Z,
I love RingConn,"I love RingConn. The app is easy to use, it tracks so much information.",5,2025-02-23T16:11:50.000Z,
Good product,"Date of experience: January 31, 2025",5,2025-02-23T04:31:30.000Z,
,"The company is responsive when I email them or submit feedback via the app, usually responding within 3 business days. There are frequent updates as they roll out new features and/or fix bugs. The rinSee more",5,2025-06-16T16:25:05.000Z,
,The RingConn has helped me better assess my sleep more than any other device has! I highly suggest this ring since there’s no monthly fee & the app shows some fun stuff coming on the horizon for the aSee more,5,2025-06-16T14:49:54.000Z,
,Love the idea of the ring. Somethings to note. It gets scratched very easily and I'm not expecting it to look great a year from now. Also there are no postpartum or pregnancy setting for the fertilitySee more,4,2025-06-18T23:43:57.000Z,
,Still relatively adjusting but so far everything has been as great as i expected. The only thing is that the app doesn’t take temp on demand- only when sleeping. Other than that- i love the purchase.,4,2025-06-16T11:11:52.000Z,
Prompt service,Customer service has been efficient and prompt. Happy so far with my selection of this product,5,2025-02-22T23:37:35.000Z,
"Great fit, super comfortable smart ring with the best battery by a wide margin.","The ring feels and looks great. Extremely comfortable to wear all day/night. Battery life is impressive and as good as it claims, unlike other competitors. But app needs work. UiX is a bit clunky and not intuitive. Stress measurement is not accurate at all.",3,2025-02-22T21:11:37.000Z,
There’s room for improvement.,"I like the ring sizing kit. It was more than what expected. I wear the actual ring every day. It is solid and comfortable. Also waterproof. I don’t have to take it off to shower. The only improvement that it needs is better accuracy of the oxygen monitoring. I wear a pulse oximeter (Wellue) that is very accurate. The ring, in comparison, reads 3-5 points higher consistently. If that could be improved, I would trust it more to wear alone and not have to use the extra device.
Hopefully the battery will hold its 7 day charge for a long time, which is another great feature.",4,2025-02-22T15:06:57.000Z,
"Lacks major connected app support. MFP, google health, etc...","This ring does no tnconnect well to 3rd pty apps

There is no google health support, which replaced fit, and is literally 1/2 of the market share for android phones in the US, probably the world.

Step syncing to fit is not 1:1 counts are horribly off, and remain that way, its not a syncing lag, its literally the wrong data.

The ring itself is awesome with a great app and amazing insights, but most of us are going to use My fitness pal, or some other health app, and neither are compatible with this device either

There are some easy wins here if Rongconn fixes this, but if your expecting this ring to fit your ecosystem you will be disappointed in the lack of connected app support.",2,2025-02-22T09:11:24.000Z,
Is not very accurate so it’s not that…,Is not very accurate so it’s not that helpful.,2,2025-02-22T03:52:31.000Z,
Love this ring,Love this ring! Tracks my sleep apnea and all the info I need is there.,5,2025-02-22T02:41:54.000Z,
Allow activities to be rearranged,It would be nice if the order of the activities could be rearranged. I do an outdoor walk but it’s last on the list to select.,4,2025-02-22T02:34:44.000Z,
great battery life,"great battery life, very simple to use app and no subscription costs",5,2025-02-21T22:47:30.000Z,
I love my RingConn,I love my RingConn. Shipping and delivery were very fast. Set up was quick. The user experience within the app is nicely laid out and information is presented in a way that is easy to read.,5,2025-02-21T22:41:07.000Z,
I'm in love!,I like the look and feel on my finger; very accurate; amazing app; no subscription fee; long battery life. What's not to love?,5,2025-02-21T22:21:27.000Z,
Good choice,"""I am very satisfied with the experience. The ring is as expected. I am glad I made this choice.""",5,2025-02-21T22:02:41.000Z,
Great product and company is always…,Great product and company is always working to improve the product!,5,2025-02-21T21:34:36.000Z,
i love the ring,"i love the ring, it keeps me acountable of my sleep patterns, and definetly is more accurate in counting my steps than your cellphone. I also love the fit , I hve the color gold which I love. I hve recommended this to one of my friends and she also loves it.",5,2025-02-21T20:27:12.000Z,
RingConn is very comfortable to use,"RingConn is very comfortable to use, all features are very detailed and I can track better my life style.",5,2025-02-21T19:53:15.000Z,
I love the ring so much,"I love the ring so much, it's helped me learn so much about myself. But shipping took a ridiculously long time and most of that time was your company holding my product.",4,2025-02-21T19:48:55.000Z,
The amount of data the ring acquires is…,"The amount of data the ring acquires is just overwhelming. Sleep tracking is interesting. Stress monitoring does not fit to my subjective feeling. Stress is said to be high when I was relaxed and vice versa.
The heart rate during indoor cycling is completely incorrect. During outdoor running it fits to my applewatch. Overall a great experience.",4,2025-02-21T19:07:16.000Z,
Absolute Disappointment,"Absolute Disappointment!
The period predictions are totally off let alone the ovulation window. This was a big reason for buying the ring and I have very disappointed on spending so much for something that cannot be used for the intended purposes. I have started recommending people spend a little more and get a product that can atleast help with accurate predictions. Other brand rings are letting people know they are getting sick/pregnant beforehand and this ring even with a 102 degree temperature showed by body temperature in range.What else can I say.",1,2025-02-21T19:06:31.000Z,
Very satisfied,"I recently upgraded from a Gen1 to a Gen2, and the customer service team has been fantastic. They were incredibly helpful, knowledgeable, and a pleasure to work with.",5,2025-02-21T19:05:51.000Z,
Love it ❤️,I have to say this was a great option for a smart ring. I have referred many people. Love that there’s no monthly fee.,5,2025-02-21T18:49:31.000Z,
The RingConn Gen 2 (RCG2) is an…,"The RingConn Gen 2 (RCG2) is an excellent health ring that helps me meet my health goals. It tracks my steps, heart rate, and blood oxygen level. I shopped around, and chose RCG2 because it does what the others do, but also has sleep apnea detection. It is thin and light, and has longer battery life than the competition. It also has no subscription fee to use the app. A bonus is that the app shares data with Google Fit app, and I use both. My only complaint is once I confirmed the size, and changed my mind on color, the online order page never showed a change in choices or order status, then it took two weeks to arrive. However, customer service was quick to respond, and reassuring. It is beautiful, and comfortable. I'm very happy with it, and would recommend to others.",5,2025-02-21T18:25:47.000Z,
,"The company is responsive when I email them or submit feedback via the app, usually responding within 3 business days. There are frequent updates as they roll out new features and/or fix bugs. The rinSee more",5,2025-06-16T16:25:05.000Z,
,The RingConn has helped me better assess my sleep more than any other device has! I highly suggest this ring since there’s no monthly fee & the app shows some fun stuff coming on the horizon for the aSee more,5,2025-06-16T14:49:54.000Z,
,Love the idea of the ring. Somethings to note. It gets scratched very easily and I'm not expecting it to look great a year from now. Also there are no postpartum or pregnancy setting for the fertilitySee more,4,2025-06-18T23:43:57.000Z,
,Still relatively adjusting but so far everything has been as great as i expected. The only thing is that the app doesn’t take temp on demand- only when sleeping. Other than that- i love the purchase.,4,2025-06-16T11:11:52.000Z,
Great customer service,"Great customer service, great product.",5,2025-02-21T18:16:40.000Z,
Wonderful product,The ring arrived promptly and was well packaged. I have been wearing the ring consistently since I received it. I love the sleep apnea part f the ring. The information that it gives is amazing.,5,2025-02-21T17:56:53.000Z,
Their support,The best I was amazed by their support,5,2025-02-21T17:06:05.000Z,
Great Resource,"I received my ring about 6 weeks ago and really enjoy it. I love the step tracker, sleep tracker, and that it will track my stress and vital signs which is important to me. I enjoy that I can share data with friends…my husband and I have a competition for who gets more steps (and sleep!) I have noticed that it will label it “light sleep” when I’m laying down watching a movie. The only other thing I would love to be able to do is trigger it to track my vitals at specific moments. Otherwise, I say it was a great investment and appreciate that there isn’t a monthly fee.",4,2025-02-21T16:59:48.000Z,
Great ring,"I love the ease of connecting the ring to the Bluetooth and the app.
I love the sleep apnea & hypopnea assessments.
However,I miss the data, explanations and graphics of the Ouraring.
However because there is no maintenance fee, it makes sense.
Thank you.",4,2025-02-21T16:58:17.000Z,
Great health monitor.,"The ring was slow to ship, but it has been worth the wait. I love the detailed information and functionality provided in the app all without a monthly subscription. The sleep apnea monitoring is a big part of why I waited to puchase a higher end health monitor. It appears accurate. The readings are even a little higher than what my CPAP machine reads. The only thing lacking is it's ability to pick up naps, but at least they can be manually added. Additional exercise options would be nice too. I don't actually use that feature because nothing matches what I usually do.",4,2025-02-21T16:56:08.000Z,
Solid product,"Works as advertised, strong battery life, fit and finish is really good. Being able to use HSA money was a big positive.",5,2025-02-21T16:33:01.000Z,
Comfy and informative,"Comfy and informative! The sizing ring option was great so I could make sure I got the best one, and overall it's super comfy to sleep in, and even with my smaller hands the ring doesn't look bulky or abnormal. I love seeing the information and stats and the battery life is great--if you charge it when you do things like shower, you don't have to worry about having it off any night or for long periods.",5,2025-02-21T16:17:42.000Z,
I am so happy with my device,I am so happy with my device! I switched from a smart watch and couldn't be happier.,5,2025-02-21T15:46:57.000Z,
Unfit for Purpose,"There is no facility to enter fitness activities, despite showing a girl working out with weights in the promotional material. It is completely useless for me. Total waste of time.",1,2025-02-21T15:07:45.000Z,
I have had a mostly positive experience…,"I have had a mostly positive experience with my ring.
It seems to be inaccurate when I compare SPO2 levels ie vital signs vs sleep apnea monitoring.
It sometimes irritates my finger because of thickness/shape.
Overall, I really prefer Ringconn over watches and other SPO2 monitors.",4,2025-02-21T15:07:27.000Z,
The ring fits great and lasts for close…,"The ring fits great and lasts for close to 2 weeks on 1 charge. No subscription needed to track my vitals. Not so sure how much I trust the sleep apnea but so far looking good. Wish it did more for workout tracking, but from what I'm reading that's a limitation on rings in general. So far I'm very happy with the purchase.",4,2025-02-21T15:05:16.000Z,
Not quite what I expected,I use a wrist step counter too. The wrist counter and the ring have significantly different step counts. In addition it takes awhile for it to update each day.,3,2025-02-21T15:04:07.000Z,
This is a great product,"This is a great product, a game changer in my health, the sleep app is so much better than the Fitbit I was using before.",5,2025-02-21T14:57:05.000Z,
Delivering process,"The problem I experienced is that choosing express delivery, it did not inform the estimated delivery date.",4,2025-02-21T14:25:32.000Z,
"it doesn't track weight, most health insurance apps don't connect","Golly it tracks almost everything else except weight. Heart rate, sleep apnea. Stress, skin temp. Battery is awesome",3,2025-02-21T14:07:57.000Z,
I love my RingConn,"I love my RingConn I was looking for a smart device mainly to monitor my sleep and stress levels and its been fantastic, the battery is very long-lasting having about a week of life before I need to charge, the data seems accurate and although there is room for improvements in some areas overall is an excellent product and without extra cost, unlike others in the market.",5,2025-02-21T13:51:14.000Z,
"Love the riing, once I got it","Love the ring and app. I only wish they could have said how long it would take to get the ring once it was ordered. It was about 4 weeks, but all they would say is ""We received your order and are working hard to get it to you, we'll let you know when it ships."" So I didn't know if it would be days or months. If they could give a very rough time frame to set expectations, it would have been a better buying experience.",4,2025-02-21T13:45:53.000Z,
No accurate readings for exercise…,No accurate readings for exercise (submitted a complain) and heart rates. Also I have noisy snoring and difficult breathing in sleep which were not detected.,1,2025-02-21T11:55:41.000Z,
Excellent and timely service,"Excellent and timely service by e-mail whenever I needed it, and also timely delivery of the ring before Christmas. Thank you",5,2025-02-21T10:45:40.000Z,
,"The company is responsive when I email them or submit feedback via the app, usually responding within 3 business days. There are frequent updates as they roll out new features and/or fix bugs. The rinSee more",5,2025-06-16T16:25:05.000Z,
,The RingConn has helped me better assess my sleep more than any other device has! I highly suggest this ring since there’s no monthly fee & the app shows some fun stuff coming on the horizon for the aSee more,5,2025-06-16T14:49:54.000Z,
,Love the idea of the ring. Somethings to note. It gets scratched very easily and I'm not expecting it to look great a year from now. Also there are no postpartum or pregnancy setting for the fertilitySee more,4,2025-06-18T23:43:57.000Z,
,Still relatively adjusting but so far everything has been as great as i expected. The only thing is that the app doesn’t take temp on demand- only when sleeping. Other than that- i love the purchase.,4,2025-06-16T11:11:52.000Z,
So far and I have my ring since…,"So far and I have my ring since December, there is nothing negative to say. The only thing is that I paid for an express delivery and that did not work out as I had to wait the normal shipping time. Other than that I have no complaints so far. The App is good - I maybe wish it would show more workout options and maybe even skin temperature during the day and not only while sleeping. OVERALL I am very happy with the ring as of yet.",4,2025-02-21T10:29:34.000Z,
works great and looks good,"Date of experience: February 20, 2025",5,2025-02-21T10:15:59.000Z,
Fantastic company,Fantastic company. The whole ordering process was completely smooth. The stated delivery times were adhered to. The ring is a super product. Very well made and all functions have been working for weeks without the slightest problem. I am delighted and have already bought 2 additional rings for the family in the meantime.,5,2025-02-21T09:58:46.000Z,
I expected better,The ring looks good and fits perfectly. The app is poorly translated to Finnish and SpO2 shows false when i tested also the rates with a real medical device. I expected better quality with this price.,3,2025-02-21T09:49:20.000Z,
After the first month,"After the first month I can say the ring experience is great: easy to use, detailed and easily understandable. Great to have a sizing kit before purchasing the ring. Customer care quickly answer. The shipment is not the fastest (especially compared to famous brands), but quick enough",5,2025-02-21T09:47:47.000Z,
Good,"Good data, and ring looks nice. Only downside is that battery life is more like 6-7 days instead of 11.",4,2025-02-21T09:33:57.000Z,
The RingCon 2 is perfect to wear and…,"The RingCon 2 is perfect to wear and make a great job! I like the App, where you can see all important health topics!",5,2025-02-21T09:31:10.000Z,
you don’t need anything else,best product to buy.,5,2025-02-21T08:50:52.000Z,
Network Connection Problem,"Network Connection Problem

I like the features, but if it doesn’t work, it‘s terrible. After the last update i can‘t get an Network Connection.
Please fix that.",3,2025-02-21T08:31:56.000Z,
It tells me all I need to know about my activities in the day,It tells me all I need to know about my day,5,2025-02-21T07:49:34.000Z,
RingConn has exceeded my expectations…,"RingConn has exceeded my expectations since the moment I placed my order. The ring itself is AMAZING - it has far more features than I thought it would have and it is incredibly useful for me. In addition, the price is great, the customer service is fast and helpful. I am recommending this product to all of my clients and friends!",5,2025-02-21T07:36:42.000Z,
Sort of good,"I bought the ring with the hope of replacing a monitoring band for sleep and stress tracking.
The experience has been ok...ish. It tracks your pulse and blood oxigen quite accurately. Also stress during the day is pretty accurate.
When it comes to sleep tracking, that's where things take a turn for the worse. While it is quite good in identifying when you go to sleep (it makes the difference between sleeping and just lying on the couch watching a movie), the actual sleep parameters, I find are quite off. You generally wake up to a sleep score of over 85 even on bad nights. HRV during the night, for me, was quite unchanged, whether I had a relaxation day or an intense workout day with lots of work besides it. It generally overshoots both REM and Deep Sleep, undershooting awake time.
Activity tracking is limited to walking, running and biking and only if location is turned on. This last part, for me, was enough reason to not use it as an activity tracker.
On the plus side, support is really fast on answering questions and addressing problems, however, I do not know how much of the feedback they use for improvement.
There is lots of potential in this ring, but some of the aspects really need atention.",3,2025-02-21T07:21:38.000Z,
Great response to suggestions and improvement request feedback!,Product worked very well; I wear it all the time except when charging. Excellent response for improved SP02 calibration in comparison to my FDA approved medical device. I was so happy with it I gave the first one to my son (I bought it as soon as it was available) and upgraded to the newest version. Well worth the money!,5,2025-02-21T05:14:45.000Z,
Sleep apnea monitoring,It have got a very good sleep apnea monitoring. Much lesser on activities and sports but very good for sleep monitoring and heart rate variability monitoring. It can even detect if u are going to be unwell for you to get more rest and recover.,5,2025-02-21T03:59:31.000Z,
Well made,"Well made, good battery life",5,2025-02-21T03:16:52.000Z,
It does not track sleep accurately,It does not track sleep accurately,2,2025-02-21T02:37:24.000Z,
Short battery life,"My ring only lasts 3 to 4 days on a full charge. The main reason I purchased this ring is because of the battery life. Very disappointing. I already wrote to customer service. I told them of the issue. They sent back some stuff I could try, but none of it worked.",3,2025-02-21T02:36:09.000Z,
