Title,Content,Rating,Date,Author
,"The company is responsive when I email them or submit feedback via the app, usually responding within 3 business days. There are frequent updates as they roll out new features and/or fix bugs. The rinSee more",5,2025-06-16T16:25:05.000Z,
,The RingConn has helped me better assess my sleep more than any other device has! I highly suggest this ring since there’s no monthly fee & the app shows some fun stuff coming on the horizon for the aSee more,5,2025-06-16T14:49:54.000Z,
,Love the idea of the ring. Somethings to note. It gets scratched very easily and I'm not expecting it to look great a year from now. Also there are no postpartum or pregnancy setting for the fertilitySee more,4,2025-06-18T23:43:57.000Z,
,Still relatively adjusting but so far everything has been as great as i expected. The only thing is that the app doesn’t take temp on demand- only when sleeping. Other than that- i love the purchase.,4,2025-06-16T11:11:52.000Z,
Love the idea of the ring,Love the idea of the ring. Somethings to note. It gets scratched very easily and I'm not expecting it to look great a year from now. Also there are no postpartum or pregnancy setting for the fertility tracking which would improve the data for sure. Over all its comfortable and the battery is wonderful.,4,2025-06-18T23:43:57.000Z,
Solid.,The shipping took a while but the quality and battery life of the ring is really good. The only thing is that I wish it tracked more workouts. The app is easy to use.,4,2025-06-18T17:31:31.000Z,
Does what it says it’ll do!,"Works as described, even while wearing it on my thumb. Well priced, although I’d prefer if it were not made in China. Enters sleep mode automatically and readings are accurate.",5,2025-06-18T14:13:20.000Z,
Support extremely supportive!,"The support people are extremely helpful. I had a problem with the battery in my Ring Gen 2. They did some troubleshooting with me but, when that didn't work, they sent me a replacement ring before I returned my old ring.",5,2025-06-18T01:30:53.000Z,
Super happy with it,"Super happy with the rings performance, only con is that it could use more exercise options",5,2025-06-17T13:30:28.000Z,
Overall not bad,"Overall not bad, step count could be more accurate.",4,2025-06-17T05:54:16.000Z,
Great product,"Great product, works well, feels comfortable and isn’t heavy. Nice sizing and overall process.",5,2025-06-17T05:27:55.000Z,
Excellent support,"Excellent support. Ordered the wrong ring size and RingConn took care of me very quickly. My experience, the ring size kit is true to fit. I am very happy with the performance of my new ring and would highly recommend this product to anyone",5,2025-06-17T01:40:50.000Z,
The ring is providing just what I was…,The ring is providing just what I was looking for with the benefit of not having to pay for a subscription with no benefit.,4,2025-06-16T18:58:00.000Z,
Best Smart ring I have tried,"The company is responsive when I email them or submit feedback via the app, usually responding within 3 business days. There are frequent updates as they roll out new features and/or fix bugs. The ring battery lasts me about 9 days (with daily exercise mode) and I wear it constantly. I also walk about an hour a day and the battery holds up well in exercise mode. I did an interview when they were rolling out the women's health, and they sent me a thank you gift that was beautiful and well packaged. I like the data and how it is presented in graphs.",5,2025-06-16T16:25:05.000Z,
Great Ring,Great Ring. Does a great job tracking sleep. Very comfortable. So much better to sleep in than a watch.,5,2025-06-16T16:16:41.000Z,
The RingConn has helped me better…,The RingConn has helped me better assess my sleep more than any other device has! I highly suggest this ring since there’s no monthly fee & the app shows some fun stuff coming on the horizon for the already existing ring!,5,2025-06-16T14:49:54.000Z,
Good stats tracker,This is a much better vital stats tracker then Fitbit .,5,2025-06-16T12:09:39.000Z,
Good product,"Company was quick to respond to my questions.
It took a little bit to get my ring; however was well worth the wait. Fantastic battery life and great information.
My husband wants to switch from his Oura and get one of these.
Ring fits true to size using their ring guide.",5,2025-06-16T11:52:02.000Z,
Still relatively adjusting but so far…,Still relatively adjusting but so far everything has been as great as i expected. The only thing is that the app doesn’t take temp on demand- only when sleeping. Other than that- i love the purchase.,4,2025-06-16T11:11:52.000Z,
The best fitness tracker I’ve used!,"Date of experience: May 19, 2025",5,2025-06-16T09:21:15.000Z,
"Ring is nice, app syncing with others could be better",Product seems to be well thought out. Slim and comfortable to wear. Wear it working out and to sleep and does not distract me at all. Would have given it a solid 5 stars if the data could be synced with other apps easier. Data is more useful when combined with other sources.,4,2025-06-14T19:44:30.000Z,
Good experience,good product. shipping took a while but happy with the Ring,5,2025-06-14T02:48:54.000Z,
Deceptive and Sketchy Company!,The gold ring featured on the website was not the color I received. It was a completely different ring! The women I spoke to on the phone even confirmed there was a difference in color and said it is a common complaint. That is deceptive marketing and extremely sketchy! I also have yet to receive my refund for the ring. Followed all the difficult return instructions and still no refund.,1,2025-06-13T17:17:40.000Z,
The ring is doing everything I wanted…,The ring is doing everything I wanted it to do and more,5,2025-06-12T13:50:08.000Z,
,"The company is responsive when I email them or submit feedback via the app, usually responding within 3 business days. There are frequent updates as they roll out new features and/or fix bugs. The rinSee more",5,2025-06-16T16:25:05.000Z,
,The RingConn has helped me better assess my sleep more than any other device has! I highly suggest this ring since there’s no monthly fee & the app shows some fun stuff coming on the horizon for the aSee more,5,2025-06-16T14:49:54.000Z,
,Love the idea of the ring. Somethings to note. It gets scratched very easily and I'm not expecting it to look great a year from now. Also there are no postpartum or pregnancy setting for the fertilitySee more,4,2025-06-18T23:43:57.000Z,
,Still relatively adjusting but so far everything has been as great as i expected. The only thing is that the app doesn’t take temp on demand- only when sleeping. Other than that- i love the purchase.,4,2025-06-16T11:11:52.000Z,
Awesome ring and service,The ring works great and battery is lasting 9 days. I found the information recorded to be very similar to my Samsung Watch. The sizing is the same as the one from the sizing kit. Delivery was pretty quick to Australia. Great product and service!,5,2025-06-12T10:36:27.000Z,
Good Design,Everything looks fine.,5,2025-06-12T09:17:44.000Z,
Product has a long battery life,"Product has a long battery life, seems pretty accurate, looks amazing and comfortable to wear daily.",5,2025-06-11T15:06:52.000Z,
One ring rule all them all,Great Ring with style and light to wear. Track all my health information.,5,2025-06-11T09:13:07.000Z,
It is pretty accurate compared to my…,It is pretty accurate compared to my Apple Watch. I wish it integrated with apps I.e peloton or any fitness app. Thinner than most rings on the market. Limited workout options. Love the sleep analysis,4,2025-06-10T03:48:11.000Z,
good product,good product. delivery took long and was a bit stressed about the local delivery company,4,2025-06-09T21:53:11.000Z,
I love this ring,I love this ring but more than that I love the customer service help that is given. They have gone above and beyond to help me.,5,2025-06-09T19:48:16.000Z,
Good health status update,Good health status update,5,2025-06-09T17:58:34.000Z,
I like that it really helps track my…,"I like that it really helps track my sleep,that the main reason why i use it :)",5,2025-06-09T16:16:44.000Z,
Does exactly what I wanted,"Does exactly what I wanted. Monitors my sleep and my steps.
Size could be a half size smaller but the lower size would have been too tight in the summer heat - swelling of fingers.",5,2025-06-09T15:11:24.000Z,
My ring came quick,My ring came quick. I love the sleep information and tracking my exercise. I've already recommended it to friends and coworkers.,5,2025-06-09T14:52:06.000Z,
Great tracker,"Many things to like about this ring - comfortable, excellent battery life, free app with great info, overall performs it consistently well. I like the workout tracking for walking/running and how it shows distance and path. Would like to see more workout options, e.g., yoga, strength training, just to keep record of those workouts as well.",5,2025-06-09T13:19:18.000Z,
Easy and comfortable to wear & battery…,Easy and comfortable to wear & battery life is great!,5,2025-06-09T13:15:53.000Z,
Easy to use and understand,Easy to use and understand. Love this product.,5,2025-06-09T12:07:12.000Z,
Love the ring for the most part,"Love the ring for the most part. The exercise category could use some improvement. There’s not many exercises to choose from (run, walk, cycle) and it does not transfer data from Apple health. It looks as if I haven’t exercised when I weight lift because I don’t wear the ring, but I would have that data if it successfully gathered information from Apple health.",4,2025-06-09T12:04:32.000Z,
Love their products,"Love their products!
Customer service was great.",5,2025-06-09T11:02:03.000Z,
Good ring,"Overall it’s a great ring but would have like for it to have little reminders of when I’m fertile, that would help the ladies when trying to conceive.",4,2025-06-07T16:51:18.000Z,
"Slow starting, but...","Well, I faced issues with the courier. It took long time to arrive. Then the size is slightly greater then the kit size rings. If I had know, I would order one size less.
That said, it is a good product, I like it more and it is a great travel companion",4,2025-06-07T12:34:15.000Z,
Needs to have a swimming tracking,Needs to have a swimming tracking,3,2025-06-07T08:49:26.000Z,
Feedback,"I have had my RingConn for almost a month (June 15 exact date) with no problems until today. The RingConn will not stay connected to Bluetooth and I have reset it and it’s still doing it. Also, when not in use it stated my heart rate was between 143 to 148. How when it was sitting on the table. Is there something wrong with my ring? Debating on sending it back for a refund.",3,2025-06-07T01:42:21.000Z,
,"The company is responsive when I email them or submit feedback via the app, usually responding within 3 business days. There are frequent updates as they roll out new features and/or fix bugs. The rinSee more",5,2025-06-16T16:25:05.000Z,
,The RingConn has helped me better assess my sleep more than any other device has! I highly suggest this ring since there’s no monthly fee & the app shows some fun stuff coming on the horizon for the aSee more,5,2025-06-16T14:49:54.000Z,
,Love the idea of the ring. Somethings to note. It gets scratched very easily and I'm not expecting it to look great a year from now. Also there are no postpartum or pregnancy setting for the fertilitySee more,4,2025-06-18T23:43:57.000Z,
,Still relatively adjusting but so far everything has been as great as i expected. The only thing is that the app doesn’t take temp on demand- only when sleeping. Other than that- i love the purchase.,4,2025-06-16T11:11:52.000Z,
Awesome product!,"Comfortable, great fit, long battery life. Tells me a ton of data about my fitness, vitals, sleep quality. Fast shipping and reasonable price too!",5,2025-06-06T16:15:29.000Z,
review,great delivery,5,2025-06-06T16:07:13.000Z,
Almost perfect,The ringconn gen 2 air is almost perfect. The bad thing is the step counter that is way off the reality.,4,2025-06-06T15:44:52.000Z,
Easy to use and been reliable the first…,Easy to use and been reliable the first month!,5,2025-06-06T15:07:08.000Z,
I love this ring battery life is long,"I love this ring battery life is long , step accuracy is not the greatest but still good , I love the sleep analysis very thorough overall I give this ring a 5 start",5,2025-06-06T14:14:41.000Z,
The ring doesn’t accurately track,The ring doesn’t accurately track. It is a waste of money! Just go and get an apple watch for the money and accuracy.,1,2025-06-06T14:01:08.000Z,
Outstanding Product,"Outstanding product - yes, would buy again!",5,2025-06-06T13:14:52.000Z,
Inaccurate,After using the RingConn Gen2 for one week I find it to be inaccurate in many aspects particularly step count as compared to both my Apple Watch and iPhone. I also found that the O2 saturation levels were inaccurate as compared to my pulse oximeter. It did not detect nap times either. Although it is an attractive ring I’m questioning its accuracy in other areas as well.,2,2025-06-06T11:36:19.000Z,
Excellent.,"Date of experience: April 25, 2025",5,2025-06-06T10:53:12.000Z,
Love it,Having used smart rings for many years this is so far my favourite. Ring looks nice. App has clear UI. No BS monthly fee or subscription required to access ur data,5,2025-06-06T05:27:50.000Z,
It's early but overall very satisfied,"Over all I am very satisfied with the ring. It doesn't have more bells & whistles than necessary. I wish the app was a bit more customizable. I talked to customer service a couple of times for clarification- first time the representative made me feel very confident that the answers they gave were correct. Second time a little different experience but not enough to keep me from ordering. My questions were if the actual ring was the same size as the sizing kit or slightly smaller or bigger. Told slightly smaller, when I got the ring it was actually slightly bigger, very slightly. I went with the size that the sizer was slightly difficult to get over my knuckle. Would have preferred a 1/2 size but informed not available, doesn't hurt to ask. Actual ring slides a bit too easy a 1/2 size smaller would have been perfect.
Look forward using this for a lot longer than I used my Fitbit charge6.",4,2025-06-06T01:57:43.000Z,
Great ring overall! Just needs some improvements in monitoring workouts.,"This has been a great smart ring! The price is right and I love that the app and plethora of data are both free. The first ring I received was not tracking vitals properly, but RingConn was responsive and sent a replacement ring (it did take a couple of weeks). This ring has been consistently tracking data and I love how many graphs are provided for interpretation. It seems to do a good job with step tracking (at least for trends), but it struggles to accurately monitor my heart rate during rowing workouts. I have automatic workout mode detection on and even set it to an indoor cycling workout, but my heart rate is rarely registers above 110 bpm. It does much better during running workouts.

Women’s health cycle tracking was one of my main reasons for purchasing. It’s very simple, but temperature shifts was all I needed, so this does the job just fine.

Overall, I would definitely recommend the ring!",4,2025-06-05T21:53:46.000Z,
My new ring works great,My new ring works great. Its just like it was advertised to be. I'm very happy.,5,2025-06-04T20:50:56.000Z,
Love the ring!!,"Love the ring! This is my 2nd one and would buy it again! Only thing that I would change is I wish I could disable the period tracker. But that's it.
All the other information is great and I use it to stay on top of my health as much as possible!!",5,2025-06-04T18:30:48.000Z,
Room for accuracy improvement,I think the sleep tracking is accurate along with stress. The heart rate is terrible. i did an intense HIIT cycle workout for 15 minutes where I know it is burning at least 100 calories and my ring said it burned 7... and the my BPM is like 75. So that's frustrating that the calorie burn is not accurate and I can't return it even if I wanted to.,3,2025-06-04T17:12:39.000Z,
ring does not count properly steps,"ring does not count properly steps. It has huge difference to benchmark devices (like watch, etc) by approximately 20-30% more steps! I compared for already 2 weeks and nothing improves.",2,2025-06-04T16:17:56.000Z,
Love it,"I love my ring, easy to wear and comfortable. The data is quite accurate beside the period tracker, hence why a four star. The period tracker is a bit off for me and there’s no way to see all the symptoms you’ve put and go back quickly to see them. Maybe it is different for others. Otherwise I absolutely love it. I would loooveeee to have new things on it like caffeine window, hopefully soon ☺️",4,2025-06-04T14:58:00.000Z,
Very responsive and super helpful,Very responsive and super helpful. Having to monitor for several weeks before any action could be completed though was a little difficult.,4,2025-06-04T14:56:50.000Z,
Blows the competition out of the water!,"Blows the competition out of the water!
The battery life is amazing, only have to charge one every 9 days and it takes about an hour. The fit is great, it's not too thick of a ring and feels and looks great on your finger. My one and only flaw is that it scratches very easily, but I wear this sucker to do everything so that may be on me :)",5,2025-06-04T14:49:42.000Z,
The ring itself is wonderful,"The ring itself is wonderful, good metrics, good quality, weight and size. The app is fine too, but i think the AI Partner could be more helpful and personal.",5,2025-06-04T14:47:14.000Z,
,"The company is responsive when I email them or submit feedback via the app, usually responding within 3 business days. There are frequent updates as they roll out new features and/or fix bugs. The rinSee more",5,2025-06-16T16:25:05.000Z,
,The RingConn has helped me better assess my sleep more than any other device has! I highly suggest this ring since there’s no monthly fee & the app shows some fun stuff coming on the horizon for the aSee more,5,2025-06-16T14:49:54.000Z,
,Love the idea of the ring. Somethings to note. It gets scratched very easily and I'm not expecting it to look great a year from now. Also there are no postpartum or pregnancy setting for the fertilitySee more,4,2025-06-18T23:43:57.000Z,
,Still relatively adjusting but so far everything has been as great as i expected. The only thing is that the app doesn’t take temp on demand- only when sleeping. Other than that- i love the purchase.,4,2025-06-16T11:11:52.000Z,
Please include workouts from Apps Like…,Please include workouts from Apps Like ErgData. Ring works Fine!!!,5,2025-06-04T13:22:03.000Z,
My wife loves her RingConn,"My wife loves her RingConn. The app works great with quick and accurate information, no monthly fees, and the sleek design makes the ring easy to wear all the time. I purchased this for her for mothers day and it was a hit. Would recommend 100% 👌",5,2025-06-04T13:11:25.000Z,
Great customer service,"Great customer service, a little slow getting back to me but overall great and solved my issues",5,2025-06-03T17:51:03.000Z,
I love the ring and the company was…,I love the ring and the company was easy to work with!,5,2025-06-03T12:29:55.000Z,
It fits great on my finger,It fits great on my finger. It has helped me walk more and be more active,5,2025-06-02T16:47:46.000Z,
Great product,"Great product, decent response time from customer service.",4,2025-06-02T11:03:54.000Z,
Fen2 upgrade,Great service in exchanging my Gen1 ring against a Gen2 upgrade.,5,2025-06-02T07:02:06.000Z,
Great product,"Great shopping experience. Received my ring quickly. I just adore it. I love everything about it from tracking my steps to my vitals and sleep. It is very comfortable, I don’t even realize it is on. So glad that I bought it. It definitely helps me stay motivated and more in tune with my body.",5,2025-05-31T17:56:20.000Z,
Easy to use,"Easy to use, setup and delivers everything it promised",5,2025-05-30T15:53:08.000Z,
Love this ring and battery life!,"Date of experience: April 18, 2025",5,2025-05-30T13:41:42.000Z,
Very good second experience…,Very good like the previous experience when I bought the gen 1❤️,5,2025-05-30T08:32:45.000Z,
Quick Support,"Ordered the Gen 2 Air first, but while waiting for the sizing kit to arrive I decided to go with the Gen 2. Contacted support was able to quickly get a response got the Air cancelled and the Gen 2 ordered.",5,2025-05-29T19:07:54.000Z,
The RingConn rings are working…,"The RingConn rings are working wonderfully! Long battery life and pretty accurate readings compared to our pixel 3 watches. We both have sleep Apnea and the incite into our sleep history is very helpful! Now, only if the rings could link to our adjustable beds to raise or lower would be even more helpful in getting a good night's rest!",5,2025-05-29T17:54:31.000Z,
Looooooove my ring,Looooooove my ring! I switched from an Apple Watch and it was the best decision ever. My watch was dying all the time and I truly was over getting notifications on my wrist all day but enjoyed the health tracking aspects so kept wearing it. But the ring is sooooo much better. I love tracking my sleep and my cycle. I get excited to wake up and check my sleep score every day. The battery life is amazing. I’ve had the ring about 2 months now and I’ve charged it 3 times for about 30 minutes each and that is all. I also get compliments all the time on how thin the ring is and how my friends with the other big brand wish they had done more research and got this one. 10/10 recommend!,5,2025-05-29T14:29:23.000Z,
I love the diagnostic aspect of the…,I love the diagnostic aspect of the ring and everything it tells me about my health.,5,2025-05-29T02:01:22.000Z,
I got a Ringconn for my birthday last…,"I got a Ringconn for my birthday last August. The reason I chose it is because this ring is one of the few that doesn't charge you a monthly subscription charge. I think the app is robust and it tracks a bunch of good information and feedback. My wife liked it so much she asked for one for her birthday, so that is what I got her. We now compare stats at breakfast.",5,2025-05-28T23:48:28.000Z,
I received the ring,"I received the ring, It will not pair with phone app. There is no way to get in touch with a technician. My $300 ring just sits in the box. I can't even find out how to mail it back.",1,2025-05-28T15:50:54.000Z,
Long lasting and useful analysis,"Date of experience: April 16, 2025",5,2025-05-28T11:07:29.000Z,
Wonderful customer service,Wonderful customer service! Had little issues with sizing but the supporting team was super helpful and got offered a new ring within just a few days.,5,2025-05-28T09:31:50.000Z,
RingConn air gen 2,Good product. Build quality could be better. Stainless steel scratches easily.,4,2025-05-28T06:17:11.000Z,
,"The company is responsive when I email them or submit feedback via the app, usually responding within 3 business days. There are frequent updates as they roll out new features and/or fix bugs. The rinSee more",5,2025-06-16T16:25:05.000Z,
,The RingConn has helped me better assess my sleep more than any other device has! I highly suggest this ring since there’s no monthly fee & the app shows some fun stuff coming on the horizon for the aSee more,5,2025-06-16T14:49:54.000Z,
,Love the idea of the ring. Somethings to note. It gets scratched very easily and I'm not expecting it to look great a year from now. Also there are no postpartum or pregnancy setting for the fertilitySee more,4,2025-06-18T23:43:57.000Z,
,Still relatively adjusting but so far everything has been as great as i expected. The only thing is that the app doesn’t take temp on demand- only when sleeping. Other than that- i love the purchase.,4,2025-06-16T11:11:52.000Z,
Great Smart Ring,"Exactly what I was looking for, used to have Apple Watch but my wrist keeps hurting. So far this thing does its job, besides that it’s freaking durable. And no subscription needed to top it off👍🏼",5,2025-05-28T03:34:41.000Z,
Good fit and battery lasts as long as it is supposed to! I love mine,Love that you don’t have to pay for a subscription for the app and it is so accurate. Fits great.,5,2025-05-27T16:07:46.000Z,
Reasonably good service,Representative reviewed the data and processed my rebate. Only complaint is that receipt of return was not provided automatically.,4,2025-05-27T03:08:17.000Z,
Urgently needed improvements,"Good points:
Useful data,
Long battery life,
Easy to handle ring,

What’s missing:
Überblick der fünf vitalzeichen (german)
I don’t see a possibility to visualize historic data diagrams for (Day, week, month, year) of the five vital values (vitalzeichen)

What’s to Much:
The textual explanations are boring. Permanently repeating the same Text modules. I do not need them, But I can’t disable them, Please change it.

I can’t disable Messages from Rincon, That I’m too long in bed and not moving.
But I’m just reading and working.

Accuracy
the heart rate measurement bpm It’s not reacting fast enough while In training mode. It should permanently measure my heart so that I can know when I should slow down. My Apple Watch reacts much faster when my heart rate increases or decreases again due to greater exertion during training. I wouldn’t bother if the battery life would be much shorter through training sessions.",3,2025-05-27T00:08:35.000Z,
Sleep monitoring,I bought the ring mainly for sleep monitoring. It does not appear to be very accurate. REM and deep sleep are probably close but awake is classified as light sleep often.,3,2025-05-26T22:39:04.000Z,
