Title,Content,Rating,Date,Author
,Still relatively adjusting but so far everything has been as great as i expected. The only thing is that the app doesn’t take temp on demand- only when sleeping. Other than that- i love the purchase.,4,2025-06-16T11:11:52.000Z,
Wish it did blood pressure readings,"Date of experience: April 18, 2024",4,2024-04-19T21:53:22.000Z,
Price is good and software is easy to…,"Price is good and software is easy to use.

The only issue is the finish. I workout with weight bars frequently and the ring scratches easy.",4,2024-04-19T21:36:27.000Z,
The Ring works very Good,The Ring works very Good. The free ring size kit was perfekt to try it a few Days on several fingers to test wich one is the best for me.,5,2024-04-19T19:43:25.000Z,
The battery life is superior to…,"The battery life is superior to alternatives.
The app is good, but lacks connectivity at times.
There should be a ""Low Battery"" popup notification.",4,2024-04-19T19:32:22.000Z,
Wife loves her Ring,Wife loves her Ring. It’s accurate has tons of stats and info. Easy to use app. Ring conn is a great ring. Only problem wife had was with the gold finish after a few days was wearing off. Contacted ring conn and they sent out a ring protector for it. They seem to be a company who cares,4,2024-04-19T19:25:04.000Z,
Mostly good,"Lots of information and has tips for improvement, although they seem a little generic. I am not always sure what the data means.",4,2024-04-19T19:14:12.000Z,
I miss the Czech language,"Date of experience: April 19, 2024",4,2024-04-19T19:03:05.000Z,
It does a good job with heart rate…,"It does a good job with heart rate monitoring, step counting and sleep monitoring. The battery lasts a long time.",4,2024-04-19T19:00:46.000Z,
Great product and customer support,"Great product and customer support, pre and post",5,2024-04-19T18:50:28.000Z,
Extremely inaccurate to track workout,Extremely inaccurate to track cy ling calories spent and muscular training. Disappointed by that :(,2,2024-04-19T18:36:18.000Z,
No Subscription required,I bought this ring because it is the only one that didnt not reqire a monthy subscription,4,2024-04-19T18:28:04.000Z,
Great Tech w/o monthly subscription,Great Tech and really helps me monitor my physical and mental health. The only reason it does not get 5 Star is due to not having automatic data upload.,4,2024-04-19T17:47:42.000Z,
Sleep metrics differ from other devices,"Sleep metrics differ from what I get from Oura and Samsung Galaxy Watch 6. The latter two do coincide quite well but not the RingConn, particularly Deep Sleep intervals.",3,2024-04-19T17:46:20.000Z,
Ring.com is great,My ring is wonderful. It gives me complete control over every part I of my life.,5,2024-04-19T17:21:58.000Z,
A great concept that could use improvements,"1- the lack of half sizes was a problem for me. I had to choose either a ring that was too tight or two loose. When I contacted the company for help, they were very noncommittal, basically telling me that neither would be a good idea. Well, duh. I ultimately decided on too loose because I still wanted to be able to get the ring off if I was bloated or on a hot day. That resulted in nearly losing the ring a couple of times on very cold days because it fell right off my finger! I finally solved this by purchasing a very thin, cheap ring in my size from Amazon which I wear on top of my RingConn to keep it from falling off.

2- the Wellness Balance is not explained clearly. I check it, but other than my sleep & activity, it's not really intuitive what information I'm getting from my vital signs & stress scores. More info would be more helpful.

3- they started giving wellness badges. Ok. Cool. What exactly am I tracking?

4- I pretty much use this to track my steps. It's a lot more comfortable than an apple watch.

5- I do appreciate being able to use the app without a subscription, which is why I chose this over another ring on the market.

Bottom line- I like it. But I can't say I love it. It's a great concept that could use some improvements.",3,2024-04-19T17:15:46.000Z,
My Ring Is Amazing,I am very pleased with my Ring. I check my stats every day and make sure to meet my step goal daily. I love the way the ring tracks my sleep and helps me to know what I need to improve on. I can't wait for the menstrual tracking option as well.,5,2024-04-19T17:12:58.000Z,
To the individual that would like for…Replying to a posting,To the individual that would like for their yo be a notification when ring is fully charged my let's me know when my ring is fully charged. You may want to check your notification settings to see if it's turned on.,5,2024-04-19T17:09:29.000Z,
I no longer have this ring...I sold it…,"I no longer have this ring...I sold it and then the buyer couldn't get it to work so I asked to get it sent back but never received it back. So, please don't bill me for anything as I don't have it but can get you the information of the person who does have it",3,2024-04-19T17:08:23.000Z,
Probably the best smart ring out there,"I needed a tracker for sleep and was in search for a device, which can help me get some stats without bringing much discomfort by wearing it. Startet to research a market and found out a bunch of smart rings which offer exactly what i need. After long consideretaions i have ordered RingConn and it was a right choice. For me it was importnant that battery lasts long, price/feature ratio is decent and there is no monthly subscription for it.
I was sleeping in sleep laboratory connected to monitoring systems and wearing my Ringconn ring. And results of ring measurements were really close to lab, so i am totally happy with it",5,2024-04-19T17:07:32.000Z,
At your own pace.,"At your own pace.
I've been wearing my ring for about 6 months. It assures me that I'm doing well with sleep and stress, but need some work on my movement. Overall the ring does what it should. I wish it had an option for tracking food/calorie intake, but other programs and apps are available. I would also like the ring to be less noticeable. I have short, chubby fingers, and this ring draws attention. I have the silver version.",4,2024-04-19T16:17:21.000Z,
,"The company is responsive when I email them or submit feedback via the app, usually responding within 3 business days. There are frequent updates as they roll out new features and/or fix bugs. The rinSee more",5,2025-06-16T16:25:05.000Z,
,The RingConn has helped me better assess my sleep more than any other device has! I highly suggest this ring since there’s no monthly fee & the app shows some fun stuff coming on the horizon for the aSee more,5,2025-06-16T14:49:54.000Z,
,Love the idea of the ring. Somethings to note. It gets scratched very easily and I'm not expecting it to look great a year from now. Also there are no postpartum or pregnancy setting for the fertilitySee more,4,2025-06-18T23:43:57.000Z,
,Still relatively adjusting but so far everything has been as great as i expected. The only thing is that the app doesn’t take temp on demand- only when sleeping. Other than that- i love the purchase.,4,2025-06-16T11:11:52.000Z,
DOES NOT MEASURE SWIMMING VERY…,DOES NOT MEASURE SWIMMING VERY ACCURATELY,4,2024-04-19T15:57:20.000Z,
Great ring,"The ring works very well and seems accurate and it gives plenty of updates,the only drawback for me is that i would like a couple of bigger sizes otherwise a great ring.",5,2024-04-19T15:49:18.000Z,
The ring is very helpful lots of good…,The ring is very helpful lots of good info in it. Love the activity/walking tracker. The only issue I have is that after wearing it several weeks at a time I get a rash around my finger. But I take it off a couple days and it goes away and then I can put it back on for a couple more weeks. .,5,2024-04-19T15:38:57.000Z,
Great experience,Great experience. The ring is and does exactly what I expected. Great product …so far.,5,2024-04-19T15:32:33.000Z,
"Accuracy, consistency","Love the concept, don't like the bulkiness, the sleep mode needs alittle more accuracy, ( will say I'm sleeping while reading or watching TV. But overall I like it.",4,2024-04-19T15:16:48.000Z,
The ring stops working,"After few months the ring stopped syncing with the app, so now it doesn’t work. I have updated the app a million times, nothing works anymore. Just 5-6months old",1,2024-04-19T15:09:55.000Z,
Just does not FEEL sturdy for manual…,"Just does not FEEL sturdy for manual labor. I still do not get it wet to often because I see all of the lights and STUFF. Maybe the OLDER it gets I will not care if it tears up, but I like its operation so far.",4,2024-04-19T15:02:42.000Z,
My Ring,Had become a daily part of my life.,5,2024-04-19T14:32:10.000Z,
I have a two part review,"I have a two part review. The ring itself is awesome. I love all the data I'm getting particularly about my sleep. The ring looks nice on my hand, and the charge lasts 7 days. I'm pleased with the product. Customer service is another story. I did have an issue and customer service by email was mind numbingly slow. When I did get a response it was from someone who is barely fluent in English. It was maddening.",4,2024-04-19T14:31:36.000Z,
Happy Customer,"Love getting sleep data, #steps, stress measurement in particular. Like that the product is being constantly improved. The Facebook feedback is informative and helpful.",5,2024-04-19T14:22:33.000Z,
I love my RingConn,I love my RingConn. I highly recommend to anyone who wants to track their overall health. Helps me reach my daily goals!,5,2024-04-19T14:16:32.000Z,
"No subscription, Great look and fit, regular updates..","I am very pleased with my purchase of the RingConn. I had waited alost a year fro another ring, which kept getting delayed and delayed, and finally, due to lack of true communication from the manufacturer, went to look at alternatives. This ring has terrific battery life, delivers all the salient dtata points needed for me to balance my lifestyle and looks and fits wonderfully. I hghly recommend it to anyone looking for quality and value. The best part is they continue to add functionality with every update.",5,2024-04-19T14:06:06.000Z,
Great device,Great device. Great app. Well made and useful info. I dumped my smartwatch for this. Less intrusive and now I can wear my real watch instead.,5,2024-04-19T13:55:28.000Z,
I have had the ring around one year,I have had the ring around one year. It has worked perfectly everyday and has no issues. The only complaint I have is the finish needs to be done differently. It scratches very easily and looks old really quick.,4,2024-04-19T13:51:49.000Z,
"I got the ring,it was to small I tried…","I got the ring,it was to small I tried to return it,they wouldn't take it back. So I have a brand new ring still in the box that I have had for months.",1,2024-04-19T13:10:41.000Z,
Overall very happy with the ring,Overall very happy with the ring. It took sometime to adjust to my habits it seems. The only negative is how long it took to receive,4,2024-04-19T12:24:08.000Z,
Love it,This great! I love it that I can keep it on only have to charge it every 5-6 days!,5,2024-04-19T12:18:40.000Z,
Solid smart-wear device! Can recommend!,"Solid smart wear device! I can recommend this ring. The Ringconn was easy to set up and the app gives you a ton of data. Also seems to be more accurate in a lot of instances than my Fitbit or Samsung Watch, so happy about that as well. 3. Visually, the ring is holding up too (I am a desk worker). No scratches etc. (I have the gold version)
The ordering process was a bit of a hassle due to unclear notifications regarding shipment. I was sent the fitting set twice, but it looked like my ring was shipped. All in all, it took longer than I thought or hoped. Bottomline: I can recommend this wearable!",5,2024-04-19T12:00:46.000Z,
Works great,The ring tracks well and syncs with my phone nicely.,5,2024-04-19T11:58:03.000Z,
Great device that helps me track…,Great device that helps me track improvement in my sleep. Has really helped me.,5,2024-04-19T11:46:15.000Z,
,"The company is responsive when I email them or submit feedback via the app, usually responding within 3 business days. There are frequent updates as they roll out new features and/or fix bugs. The rinSee more",5,2025-06-16T16:25:05.000Z,
,The RingConn has helped me better assess my sleep more than any other device has! I highly suggest this ring since there’s no monthly fee & the app shows some fun stuff coming on the horizon for the aSee more,5,2025-06-16T14:49:54.000Z,
,Love the idea of the ring. Somethings to note. It gets scratched very easily and I'm not expecting it to look great a year from now. Also there are no postpartum or pregnancy setting for the fertilitySee more,4,2025-06-18T23:43:57.000Z,
,Still relatively adjusting but so far everything has been as great as i expected. The only thing is that the app doesn’t take temp on demand- only when sleeping. Other than that- i love the purchase.,4,2025-06-16T11:11:52.000Z,
Not accurate,It doesn’t stay on the right spot. It isn’t accurate the finish on the ring wears of almost immediately. I am disappointed with this purchase.,2,2024-04-19T11:38:47.000Z,
Easy of use,Easy of use. No subscription. Great.,4,2024-04-19T11:19:03.000Z,
Amazing ring with a amazing app,"I've had the ring for ≈5 months now and so far I'm very happy with it.

The app is updated very frequently with new features being added. Since I got the ring there has been an updated summary as well as new features to tack outdoor running.

All my contact with the company has been really great as well. I order the protector and received a size small er than I ordered. They quickly corrected their mistake and I got 2 new protector of the correct size a few days later. I even were able to change the size after having submitted a smaller size than I actually wanted.

The ring itself is very nice and both feels and looks great. It's very comfortable to wear and I usually forget that I'm even wearing it. It's great at tracking sleep and over-all activity. Although the downside is that it's quite inaccurate when working out in a gym and the heart rate seems to be far off. But at the same time, it's not an activity tracker and I don't expected it to be as accurate for workouts as a fitness tracker.",5,2024-04-19T11:09:01.000Z,
I received an empty plastic bag,"I received an empty plastic bag stating that package was damaged, but there was absolutely nothing in the package. RingConn says that delivered it and that was the end of it.",1,2024-04-19T11:07:42.000Z,
Frequent updates & good customer…,Frequent updates & good customer support. Happy with mine & recommended!,5,2024-04-19T11:03:23.000Z,
My ring stopped charging less than one…,My ring stopped charging less than one month after I received it.,1,2024-04-19T10:39:30.000Z,
Does exactly what I wanted,"Does exactly what I wanted. Ruled out Aura due to subscription. Circle are having ""issues.""

I wear it 24/7. Swimming, sleeping, showering. Charge once a week. App just works not fuss. Kudos to RingConn after 4 months of use can highly recommend.",5,2024-04-19T10:11:49.000Z,
Loving the RingConn app and hardware,"Got it as a Christmas gift and have been using it for four months now. Loving the RingConn app and the ring. The data provided to me are priceless, the insights really motivates me to up my health game. Some of my friends have been inspired and got the ring themselves.

I’m not affiliated with RingConn.",5,2024-04-19T11:11:29.000Z,
Love the ring and app,Love the ring and app - data is detailed and accurate and battery life is excellent. If you bring out a gloss gold colour I will certainly purchase it for a more ‘dressy’ look.,5,2024-04-19T09:43:20.000Z,
The long battery life and the values…,The long battery life and the values displayed in the app are great. A very good product,5,2024-04-19T09:27:23.000Z,
Works adding new features and updates,"Date of experience: April 19, 2024",5,2024-04-19T09:21:02.000Z,
A lot of information very well…,A lot of information very well presented.,5,2024-04-19T08:40:22.000Z,
There are absolutely no complaints.,"The ring has been working flawlessly for six months now, and I am completely satisfied. The fact that I haven't needed to contact support yet is a testament to the product's outstanding quality. There are absolutely no complaints.",5,2024-04-19T08:30:55.000Z,
I an only recommend it,"used it to track my sleep and activitay, very useful, kept it on for swimming as well, very clear website for interpretation of results, excellent price",5,2024-04-19T08:11:03.000Z,
"Concept good, quality less",I Like the concept. App is great. Ring quality though leaves room for improvement. After a few months the surface is scratched and doesn’t look very good any more. Maybe you introduce a replacement option ?,3,2024-04-19T08:10:52.000Z,
The ring works great,The ring works great. And was delivered on time,5,2024-04-19T08:09:03.000Z,
I love my ring,I love my ring. When I want to know more about my overall health it really helps. I monitor my mood and what is going on at that time so I can learn to self regulate.,5,2024-04-19T08:06:16.000Z,
I'd buy it again,"I don't love the square shape of the ring.
I love the recharging case
I really like the app
I love there's no monthly fee",3,2024-04-19T07:54:20.000Z,
Better than Oura ring,I love the fact that this ring does not have a monthly payment on it,5,2024-04-19T07:37:07.000Z,
Absolutely love my RingConn … great…,"Absolutely love my RingConn … great app, great tracking of many parameters. Around a week battery life. Amazing",5,2024-04-19T07:29:43.000Z,
,"The company is responsive when I email them or submit feedback via the app, usually responding within 3 business days. There are frequent updates as they roll out new features and/or fix bugs. The rinSee more",5,2025-06-16T16:25:05.000Z,
,The RingConn has helped me better assess my sleep more than any other device has! I highly suggest this ring since there’s no monthly fee & the app shows some fun stuff coming on the horizon for the aSee more,5,2025-06-16T14:49:54.000Z,
,Love the idea of the ring. Somethings to note. It gets scratched very easily and I'm not expecting it to look great a year from now. Also there are no postpartum or pregnancy setting for the fertilitySee more,4,2025-06-18T23:43:57.000Z,
,Still relatively adjusting but so far everything has been as great as i expected. The only thing is that the app doesn’t take temp on demand- only when sleeping. Other than that- i love the purchase.,4,2025-06-16T11:11:52.000Z,
Everything as advertised,"Shipping time as advertised, ring performs as claimed.",5,2024-04-19T07:28:37.000Z,
Best tracker ever,"I like no monthly fee compared to oura ring. I bought mine in December 2023,I got free ring cover with it. Nice ring but it would be nice to have GPS if it gets lost.",5,2024-04-19T07:02:29.000Z,
Bought as a replacement for my Oura,"Bought as a replacement for my Oura
I am very pleased with it. I've read complaints from others about the finish, the app, recording workouts etc. but have experienced none of these issues. Still looks as good today as the day it was received.
5 years ago, the thought of wearing something on a finger that would give you decent metrics about your health was unthinkable. You have that today, without the monthly fees that others wish to charge. Have recommended to many.",5,2024-04-19T07:00:42.000Z,
Durable and Decent Battery Life,"When the battery is low the notification could be improved on the phone and vibration. It has been out of battery for a day many times bc I forgot to charge it and I didn't know it was dead. That is the plus side. The ring feels like a wedding ring. It is light, durable and sleek. My biggest gripe is the amount of time it takes to sync data when I want to see the data on my phone. I don't want to ALWAYS have to wait for sync to see my data. Overall does great a tracking and continuing to improve data tracking and visualization has given me a better understanding of my body.",4,2024-04-19T06:59:52.000Z,
The staff is very prompt and…,The staff is very prompt and responsive. Loving the ring.,5,2024-04-19T06:51:21.000Z,
Very good ring,"Very good ring. I use it day and night and also while working. All data are very accurate.
I only miss some small things. (Stair counter, automatic workout start)",4,2024-04-19T06:47:36.000Z,
Battery is very weak,Battery is very weak. It drains down before 48 hours and i have to put it to charge again.,1,2024-04-19T06:40:09.000Z,
Great battery runtime,"Great battery runtime, very good app with lots of data and health tips. App now in different languages. Ring is well and solid made.",5,2024-04-19T06:28:00.000Z,
Has changed my attitude toward…,Has changed my attitude toward wellness. Look forward to meeting the goals.,5,2024-04-19T05:23:54.000Z,
5 months of wearing the ring,"My wife and I both like our rings and wear them constantly. They give useful and interesting information, and it's easy to understand the data. Holds a charge for a full week. I still don't understand how it knows I'm sleeping and how deeply. I think I sleep longer than it says I do, but who am I to question ... ?",5,2024-04-19T05:00:54.000Z,
NO SUBSCRIPTION FEE,"Awesome device!! The plus point why I chose RingConn is because there is no subscription fees as compared to other brands.. does what it needs to do. Give me insights of my health daily and how to improve and now the latest update is it tracks my workout..

Anticipating for lots of new functions and improvements in the years to come and hopefully new ring designs too..

Hopefully the company stay true to us and continue not charging us a subscription fee!!",5,2024-07-15T04:56:59.000Z,
Best Smart ring!,"I bought the ring in December. The package arrived quickly to Finland! The ring has been really good! Ringconn has really good support networks on Facebook, and you can always get help if needed! The best smart ring I know! Thank you!",5,2024-04-19T04:31:05.000Z,
Did everything ok,"Did everything ok, but there is not a real implication for the data. If you get a bad sleep, the ring can’t do anything to really help you the next night.",4,2024-04-19T04:30:40.000Z,
I’ve really enjoy this product and look…,"I’ve really enjoy this product and look forward to seeing a newer, slimmer, more compact version of the ring that would be more comfortable for a woman’s hand. I’ve been wearing it 24/7 since mid Dec 2023",5,2024-04-19T04:28:38.000Z,
Highly satisfied...,"I've been using my Ringconn for over two months now. I'm really happy with my purchase. The battery lasts all week and the data I get from my sleep and activity has made me be more conscious of my health and what I need to improve. I don't have to worry about subscriptions either in order to take full advantage of the data it produces.
I'm impressed by the design and the high quality material. Very well made.
The charging case is great for traveling since I don't have to plug it in to AC to charge my ring. Overall, a great product at a great reasonable price.",5,2024-04-19T04:13:13.000Z,
ring did not fit,ring did not fit. I tried to exchange immediately. Was told because I did not use the sizing chart I could not. Threw it in the drawer never touched it since. I am sure to share my experience on every social media platform I can every time it comes up.,1,2024-04-19T03:55:47.000Z,
The ring stopped charging after 2…,The ring stopped charging after 2 months of use.,2,2024-04-19T03:37:56.000Z,
Very happy with the amount of…,Very happy with the amount of information that the ring collects. And the way it allows you to use it,5,2024-04-19T03:30:13.000Z,
I bought and used the ring for maybe a…,I bought and used the ring for maybe a week and it broke. Still kept wearing it and it fell off my finger in the ocean. Not sure of the date!,2,2024-04-19T03:22:39.000Z,
I love my Ringconn,I love my Ringconn. I have had it about 3 months now and have had zero issues.,5,2024-04-19T02:58:30.000Z,
,"The company is responsive when I email them or submit feedback via the app, usually responding within 3 business days. There are frequent updates as they roll out new features and/or fix bugs. The rinSee more",5,2025-06-16T16:25:05.000Z,
,The RingConn has helped me better assess my sleep more than any other device has! I highly suggest this ring since there’s no monthly fee & the app shows some fun stuff coming on the horizon for the aSee more,5,2025-06-16T14:49:54.000Z,
,Love the idea of the ring. Somethings to note. It gets scratched very easily and I'm not expecting it to look great a year from now. Also there are no postpartum or pregnancy setting for the fertilitySee more,4,2025-06-18T23:43:57.000Z,
,Still relatively adjusting but so far everything has been as great as i expected. The only thing is that the app doesn’t take temp on demand- only when sleeping. Other than that- i love the purchase.,4,2025-06-16T11:11:52.000Z,
Very difficult to return,Very difficult to return. They sent wrong size rings. Scratched very easily. Not very round.,1,2024-04-19T02:50:50.000Z,
Ring does perform as expected,Ring does perform as expected. Quality and value are key.,5,2024-04-19T02:50:32.000Z,
"Reliable, affordable. No monthly app fee gouging!","This ring tracker for day and night time vital signs has helped me understand lifestyle choices that impact my sleep and general health. I love that the app is free and, unlike other trackers, doesn’t gouge you with an ongoing monthly app fee.
The style of the ring is a bit clunky for my hands but is not a deal breaker.",5,2024-04-19T02:37:19.000Z,
Wish I had this years ago!!,"Great comfort, great monitoring/reporting, great battery life! Attractive (although I expected it to be shiny), not obtrusive.",5,2024-04-19T02:22:44.000Z,
